expression,meaning,sentence_translation
元気,Gesundheit / Energie / Lebhaftigkeit,"Dank Ihnen geht es mir gut."
勉強,Studium / Lernen,"Ich lerne Japanisch."
それ,das / jenes / diese Sache,"Das ist wirklich wunderbar."
恐ろしい,furchtbar / erschreckend / gefährlich / unglaublich / gruselig,"Der Bergpfad ist erschreckend steil."
一つ,eins / ein Stück / ein Objekt,"Einen Apfel, bitte."
まあ,nun ja / irgendwie / oh / tja,"Nun ja, das lässt sich nicht ändern."
一,eins / eins von etwas / der Erste,"Lass uns von vorne anfangen."
見える,sichtbar sein / aussehen / scheinen / wahrgenommen werden,"Die Sterne sind am Himmel sichtbar."
頃,als / zu der Zeit / ungefähr / etwa,"Ich erinnere mich an meine Kindheit."
小さい,klein / winzig / jung,"Ein kleiner Hund ist im Garten."
古い,alt / veraltet / traditionell,"Dieses Haus ist alt, aber robust."
動く,sich bewegen / funktionieren / aktiv sein,"Der Roboter bewegt sich."
足,Bein / Fuß / Schritt,"Mein Bein tut weh."
逃げる,fliehen / weglaufen / entkommen,"Er floh vor der Polizei."
どうして,warum / weshalb / aus welchem Grund,"Warum bist du nicht gekommen?"
時々,manchmal / gelegentlich,"Manchmal gehe ich zum Meer."
忙しい,beschäftigt / hektisch / keine Zeit haben,"Diese Woche bin ich sehr beschäftigt."
田,Reisfeld / Feld / ländliches Gebiet,"Ich arbeite auf dem Reisfeld."
今,jetzt / gegenwärtig / momentan,"Wie spät ist es jetzt?"
十分,genug / ausreichend / vollkommen,"Wir haben genug Zeit."
急ぐ,sich beeilen / hastig sein / drängen,"Lass uns zum Bus eilen."
手入れ,Pflege / Wartung / Instandhaltung,"Ich habe den Garten gepflegt."
賢い,klug / intelligent / clever,"Er ist ein sehr kluger Student."
来る,kommen / ankommen / herbeikommen,"Ein Freund kommt."
応援,Unterstützung / Anfeuern / Hilfe,"Ich unterstütze beim Spiel."
お祖母さん,Großmutter / Oma / ältere Dame,"Ich lebe mit meiner Großmutter."
隣,nebenan / angrenzend / neben,"Das Zimmer nebenan ist frei."
センター,Zentrum / Mittelpunkt / Einrichtung,"Ich war im Stadtzentrum."
管理,Verwaltung / Management / Kontrolle,"Ich verwalte Daten."
お姉さん,ältere Schwester / junge Frau,"Meine ältere Schwester geht zur Schule."
大変,anstrengend / schwierig / schlimm,"Die Arbeit ist anstrengend."
夢,Traum / Wunsch / Fantasie,"Ich hatte einen schönen Traum."
時,Zeit / Moment / Gelegenheit,"Als ich Student war, war es schön."
やっぱり,wie erwartet / letztendlich / doch / trotzdem / nach allem,"Wie erwartet hat es geregnet."
便所,Toilette / WC / stilles Örtchen,"Wo ist die Toilette?"
階段,Treppe / Stufen / Aufstieg,"Bitte steigen Sie die Treppe hinauf."
仕事,Arbeit / Beruf / Tätigkeit,"Ich habe die Arbeit beendet."
上,oben / auf / über,"Auf dem Schreibtisch liegt ein Buch."
入る,hereinkommen / eintreten / hineinpassen,"Bitte kommen Sie ins Zimmer."
出る,hinausgehen / verlassen / erscheinen,"Bitte verlassen Sie das Zimmer."
目,Auge / Sicht / Blick / Aufmerksamkeit,"Meine Augen tun weh."
どこ,wo / wohin / welcher Ort,"Wo möchtest du hingehen?"
好き,mögen / lieben / bevorzugen,"Ich mag japanisches Essen."
気,Aufmerksamkeit / Geist / Gefühl,"Bitte pass auf dich auf."
天気,Wetter,"Heute ist schönes Wetter."
開ける,öffnen / aufmachen,"Bitte öffne das Fenster."
見せる,zeigen,"Bitte zeige mir das Foto."
ここ,hier,"Bitte setz dich hier hin."
部屋,Zimmer / Raum,"Ich habe das Zimmer geputzt."
早い,schnell / früh,"Der Zug ist schnell."
お願い,Bitte / Anfrage,"Bitte warten Sie einen Moment."
落ちる,fallen / herabstürzen,"Ein Apfel fiel vom Baum."
木,Baum,"Im Park gibt es einen großen Baum."
何か,etwas / irgendetwas,"Hast du Fragen?"
中,innen / drinnen,"Bitte schau in die Box."
雨,Regen,"Es regnet."
明るい,hell / fröhlich,"Er hat einen fröhlichen Charakter."
暗い,dunkel / düster,"Das Zimmer ist dunkel."
黒い,schwarz,"Da war eine schwarze Katze."
魚,Fisch,"Ich habe Fisch gegessen."
急に,plötzlich / abrupt,"Plötzlich fing es an zu regnen."
運ぶ,tragen / transportieren,"Ich habe die Box ins Zimmer gebracht."
早く,schnell / früh,"Bitte komm früh zurück."
橋,Brücke,"Ich bin über die Brücke gegangen."
裏,hinten / Rückseite,"Im Garten hinter dem Haus."
草,Gras,"Ich habe das Gras geschnitten."
壁,Wand / Mauer,"Ein Bild hängt an der Wand."
湯,heißes Wasser / Badewasser,"Ich koche heißes Wasser."
戸,Tür,"Bitte mach die Tür zu."
こんなに,so sehr / derartig / in diesem Maße,"Ich habe so eine schöne Aussicht noch nie gesehen."
お巡りさん,Polizist / Streifenpolizist,"Ich habe den Polizisten nach dem Weg gefragt."
腐る,verfaulen / schlecht werden,"Die Milch ist schlecht geworden."
絵本,Bilderbuch,"Ich habe dem Kind ein Bilderbuch vorgelesen."
いらっしゃる,kommen / gehen / sein (höflich),"Der Lehrer kam vorbei."
きらりと,glänzend / schimmernd / funkelnd,"Ein Stern funkelte hell."
光,Licht / Strahlung,"Das Sonnenlicht ist stark."
玉,Kugel / Ball,"Ich habe eine runde Kugel aufgehoben."
気に入る,gefallen / mögen / ins Herz schließen,"Ich mag dieses Buch sehr."
光る,leuchten / glänzen,"Die Uhr leuchtet."
引っ越し,Umzug,"Ich bereite mich auf den Umzug vor."
引っ越す,umziehen,"Ich bin in ein neues Haus gezogen."
お父さん,Vater,"Mein Vater kocht."
郊外,Vorort,"Ich lebe in einem Vorort."
移る,umziehen / wechseln / übertragen,"Er ist zu einer neuen Arbeitsstelle gewechselt."
隠れる,sich verstecken / verborgen sein,"Die Katze versteckt sich unter dem Tisch."
ああ,"ah / oh / ach","Ah, das ist wirklich schwierig."
あいづち,"Zustimmung / Bestätigung / zustimmende Worte","Ich habe seine Geschichte mit Zustimmung begleitet."
あいにく,"leider / bedauerlicherweise","Leider habe ich an diesem Tag schon Pläne."
あえて,"bewusst / mutig / absichtlich","Er wagte es bewusst, eine Herausforderung anzunehmen."
あきれる,"entsetzt sein / verblüfft sein / die Geduld verlieren","Ich war entsetzt über sein Verhalten."
あくび,"Gähnen","Ich musste gähnen, weil ich müde war."
あぐら,"Schneidersitz","Er saß im Schneidersitz."
あげる,"geben / schenken / überreichen","Ich habe dieses Buch meinem Freund geschenkt."
あそこ,"dort drüben","Ich möchte dorthin gehen."
あだな,"Spitzname / Kosename","Sein Spitzname ist 'Take-chan'."
あちこち,"hier und da / überall","Ich bin seit dem Morgen überall herumgelaufen."
あちら,"dort drüben / jene Richtung","Bitte setzen Sie sich dort hin."
あちらこちら,"hier und da / überall","Die Herbstfarben sind überall wunderschön."
あっさり,"einfach / schlicht / ohne Umstände","Er hat seine Niederlage einfach akzeptiert."
あっち,"dort / in diese Richtung","Die Post ist dort."
あなた,"du / Sie / ihr","Wie lautet dein Name?"
あふれる,"überfluten / überlaufen / überströmen","Das Wasser des Flusses überläuft."
あまり,"nicht sehr / nicht besonders","Bitte denken Sie nicht zu viel darüber nach."
あらかじめ,"vorab / im Voraus","Ich habe vorab eine Liste der benötigten Dinge geschrieben."
あり,"Ameise","Die Ameisen sammeln sich um den Zucker."
あれ,"das dort / jenes","Was ist das?"
あれこれ,"dies und das / alles Mögliche","Ich war unentschlossen, welches Kleid ich kaufen soll."
あんなに,"so sehr / so viel / auf diese Weise","Wir haben so eine schöne Zeit verbracht."
あんまり,"nicht sehr / nicht besonders","Ich mag es nicht besonders."
いい加減,"unverantwortlich / halbherzig / vage","Bitte sag nichts Unverantwortliches."
いか,"Tintenfisch","Ich habe Tintenfisch-Sashimi gegessen."
いかが,"wie / was meinen Sie / möchten Sie","Wie wäre es mit Tee?"
いかに,"wie / auf welche Weise","Ich habe erfahren, wie wunderbar er ist."
いかにも,"in der Tat / wirklich / wie erwartet","Er sieht wirklich klug aus."
いきなり,"plötzlich / ohne Vorwarnung","Plötzlich begann es zu regnen."
いけない,"schlecht / nicht erlaubt / unmöglich","Man darf nicht zu spät kommen."
いずれ,"irgendwann / eines Tages","Lass uns irgendwann wiedersehen."
岸,Ufer / Küste,Wir haben ein Picknick am Ufer gemacht.
いたずら,Streich / Unfug,Das Kind hat einen Streich gespielt und wurde geschimpft.
いちいち,jedes Mal / einzeln,Du musst nicht jedes Mal alles erklären.
いつ,wann,Wann kommst du nach Japan?
いつか,irgendwann / eines Tages,Eines Tages sehen wir uns wieder.
いつごろ,ungefähr wann / zu welcher Zeit,Wann ungefähr ist die Prüfung?
いつでも,jederzeit / immer,Bitte melde dich jederzeit.
いつのまに,unbemerkt / ohne es zu merken,Unbemerkt hatte der Regen aufgehört.
いつのまにか,unbemerkt / irgendwann,Unbemerkt bin ich eingeschlafen.
いつまでも,für immer / auf ewig,Bleiben Sie für immer gesund.
いつも,immer / meistens,Sie lächelt immer.
いとこ,Cousin / Cousine,Ich habe mit meinem Cousin eine Reise gemacht.
いびき,Schnarchen,Sein Schnarchen war laut.
いやいや,widerwillig / ungern,"Es ist schwer, widerwillig zu arbeiten."
いやらしい,unanständig / anstößig / unangenehm,Schau nicht so unanständig.
いよいよ,endlich / nun ist es soweit,Endlich beginnt die Prüfung.
いらいら,genervt / gereizt,Ich bin wegen des Staus genervt.
うがい,Gurgeln,Ich gurgle zur Vorbeugung gegen Erkältungen.
うきうき,freudig / beschwingt,"Ich bin freudig, weil ich ein Geschenk erhalten habe."
うちわ,Fächer,Ich habe auf dem Sommerfest einen Fächer gekauft.
うっかり,versehentlich / unbedacht,Ich habe versehentlich einen Fehler gemacht.
うつむく,den Kopf senken / nach unten blicken,Er senkte beschämt den Kopf.
うどん,Weizennudeln,Zum Mittagessen habe ich Udon gegessen.
うなずく,nicken / zustimmen,Sie nickte zustimmend.
うまい,lecker / geschickt,Dieses Essen ist wirklich lecker.
うるさい,laut / störend / lästig,Das Zimmer nebenan ist laut.
うろうろ,herumirren / ziellos umhergehen,Ich war verloren und irrte ziellos herum.
えび,Garnele / Shrimp,Ich liebe Tempura mit Garnelen.
おいしい,lecker / köstlich,Das Sushi war wirklich lecker.
おかしい,komisch / lustig / seltsam,Dein Verhalten ist heute seltsam.
おかず,Beilage / Gericht zu Reis,Zum Mittag gab es köstliche Beilagen.
おごる,einladen (zum Essen) / spendieren,Er hat mir das Abendessen spendiert.
おしゃべり,plaudern / geschwätzig,Wir haben stundenlang geplaudert.
おしゃれ,modisch / schick,Sie trägt ein sehr schickes Kleid.
おじ,Onkel,Mein Onkel wohnt in Osaka.
おじさん,älterer Mann / Onkel,Der ältere Mann hat mir den Weg gezeigt.
おだてる,schmeicheln / loben,"Er schmeichelte, um zu bekommen, was er wollte."
おっしゃる,sagen (höflich),"Was haben Sie gesagt, Herr Lehrer?"
おなか,Bauch / Magen,Mein Bauch tut weh.
おにぎり,Reisbällchen,Ich habe ein Reisbällchen zum Mittagessen gegessen.
おば,Tante,Meine Tante ist sehr freundlich.
おばさん,ältere Frau / Tante,Die ältere Frau im Laden war sehr nett.
おまけ,Gratisbeigabe / Zugabe,Ich habe ein kleines Geschenk als Beigabe bekommen.
おもちゃ,Spielzeug,Dieses Spielzeug ist für kleine Kinder geeignet.
おやつ,Zwischenmahlzeit / Snack,Zum Nachmittag habe ich einen Snack gegessen.
およそ,ungefähr / etwa,Die Reise dauerte etwa drei Stunden.
お世辞,Kompliment / Schmeichelei,Er machte ein Kompliment zu meinem Kleid.
お中元,Mittsommergeschenk,Ich habe meinem Chef ein Mittsommergeschenk überreicht.
お互い,gegenseitig / einander,Wir sollten einander helfen.
お仕舞い,Ende / Schluss,Das war das Ende der Geschichte.
お兄さん,älterer Bruder,Mein älterer Bruder arbeitet in Tokio.
お前,du / dein (informell),Was machst du da?
お医者さん,Arzt,Ich werde morgen den Arzt besuchen.
お参り,Tempelbesuch,Wir haben einen Tempel besucht und gebetet.
近く,in der Nähe / nah,Die Bibliothek befindet sich in der Nähe der Schule.
二,zwei / Nummer zwei,Wir sind zu zweit ins Kino gegangen.
二つ,zwei Dinge / zwei Stück,Ich habe zwei Äpfel gekauft.
三,drei / Nummer drei,Ich wohne im dritten Stock.
三つ,drei Dinge / drei Stück,Ich habe drei Mandarinen gegessen.
四つ,vier Dinge / vier Stück,Im Karton sind vier Spielzeuge.
四,vier (Zahl),Vier Personen kamen zur Party.
これ,dies / das hier,Das hier ist mein Stift.
四,"vier (Zahl, alternative Lesung)",Wir fahren um vier Uhr los.
五つ,fünf Dinge / fünf Stück,Ich habe fünf Blumen gekauft.
五,fünf / Nummer fünf,Ich benutze fünf Bleistifte.
六つ,sechs Dinge / sechs Stück,Ich habe sechs Fragen.
六,sechs / Nummer sechs,Ich habe sechs Monate in Japan gelebt.
七,"sieben (Zahl, alternative Lesung)",Ich bin um sieben Uhr aufgestanden.
七つ,sieben Dinge / sieben Stück,Ich habe sieben Kuchen gebacken.
八,acht / Nummer acht,Acht Personen versammelten sich.
八つ,acht Dinge / acht Stück,Es gibt acht Kisten.
なる,werden / sich entwickeln,Er wurde Arzt.
九,neun / Nummer neun,Ich werde im September reisen.
九つ,neun Dinge / neun Stück,Ich habe neun Geschenke bekommen.
十,zehn / Nummer zehn,Ich habe zehn Bücher gelesen.
百,hundert,Ich habe Süßigkeiten für hundert Yen gekauft.
千,tausend,Ich habe tausend Kraniche gefaltet.
万,zehntausend / unzählige,"In Japan sagt man, es gibt zehntausend Götter."
円,Yen / Kreis / Rundheit,Bitte zeichne einen Kreis. Oder: ich habe 1.000 Yen bezahlt.
する,machen / tun,Ich mache meine Hausaufgaben.
日,Tag / Sonne,Heute ist ein schöner Tag.
六日,der sechste Tag eines Monats,Lass uns uns am sechsten treffen.
三日,der dritte Tag eines Monats,Ich war drei Tage lang auf Reisen.
五日,der fünfte Tag eines Monats,Am fünften gibt es eine Prüfung.
八日,der achte Tag eines Monats,Ich habe acht Tage nichts gegessen.
二十日,der zwanzigste Tag eines Monats,Der zwanzigste ist ein freier Tag.
二日,der zweite Tag eines Monats / zwei Tage,Ich habe zwei Tage lang geschlafen.
九日,der neunte Tag eines Monats,Am neunten kommt ein Freund vorbei.
ところ,Ort / Stelle / Platz,Ich möchte an einem ruhigen Ort leben.
一日,ein Tag / den ganzen Tag,Es hat den ganzen Tag geregnet.
十日,der zehnte Tag eines Monats,Am zehnten gibt es eine Besprechung.
七日,siebter Tag / sieben Tage,Am siebten Tag gehen wir ins Kino.
四日,vierter Tag / vier Tage,Der vierte Tag ist ein Feiertag.
月,Mond / Monat,Es ist eine helle Nacht mit einem Mond.
水,Wasser,Ich möchte Wasser trinken.
金,Gold,Ich habe einen goldenen Ring gekauft.
日曜日,Sonntag,Am Sonntag ruhe ich mich zu Hause aus.
土曜日,Samstag,Am Samstag spiele ich mit Freunden.
やる,tun / machen / geben,Ich muss die Hausaufgaben machen.
金曜日,Freitag,Am Freitag gibt es eine Besprechung.
月曜日,Montag,Montag ist ein stressiger Tag.
木曜日,Donnerstag,Am Donnerstag gibt es einen Test.
曜日,Wochentag,Welcher Wochentag ist heute?
火曜日,Dienstag,Am Dienstag gehe ich einkaufen.
水曜日,Mittwoch,Am Mittwoch habe ich viel Arbeit.
週,Woche,Eine Woche hat sieben Tage.
年,Jahr,Ich möchte dieses Jahr viel lernen.
分かる,verstehen / wissen / herausfinden,Ich verstehe die Antwort auf diese Frage nicht.
そう,so / stimmt / genau / ja,"Das stimmt, das ist eine gute Idee."
何,was / welches / etwas,Was möchtest du essen?
先,voraus / zuerst / Spitze,Bitte gehen Sie voraus.
今年,dieses Jahr,"Was machst du dieses Jahr?"
今日,heute,"Heute ist schönes Wetter, nicht wahr?"
今月,dieser Monat,"Diesen Monat bin ich beschäftigt."
今週,diese Woche,"Diese Woche gibt es eine Prüfung."
来年,nächstes Jahr,"Ich hoffe auf Ihre Unterstützung auch im nächsten Jahr."
もう,bereits / schon,"Es ist bereits fertig."
行く,gehen,"Ich gehe zur Schule."
帰る,zurückkehren,"Ich kehre nach Hause zurück."
大きい,groß,"Ich wohne in einem großen Haus."
少ない,wenig,"Wir reisen mit wenigen Leuten."
少し,ein bisschen / ein wenig,"Ich habe nur ein bisschen gegessen."
多い,viel / viele,"Es kamen viele Leute zusammen."
多分,vielleicht / wahrscheinlich,"Ich gehe wahrscheinlich morgen."
上げる,geben / schenken,"Ich schenke ein Geschenk."
よく,oft / gut,"Ich laufe oft."
上る,hinaussteigen / hinaufgehen,"Ich gehe die Treppen hinauf."
上,oben,"Auf dem Tisch liegt ein Buch."
下,unten,"Unter dem Tisch ist eine Katze."
右,rechts,"Ich biege nach rechts ab."
左,links,"Ich gehe nach links."
方,Person / Richtung,"Wer ist diese Person?"
大人,Erwachsener,"Ich möchte ein Erwachsener werden."
人,Person,"Diese Person ist Lehrer."
一人,allein / eine Person,"Ich bin allein gereist."
どう,wie / was,"Was denkst du?"
入れる,einschütten / einfüllen,"Ich gebe Zucker in den Kaffee."
出来る,können / möglich sein,"Ich kann Japanisch sprechen."
出す,herausholen / herausnehmen,"Bitte werfen Sie den Müll hinaus."
本,Buch,"Dieses Buch ist interessant."
休む,ausruhen / fehlen,"Ich werde heute nicht zur Schule gehen."
体,Körper,"Bitte achten Sie auf Ihren Körper."
口,Mund,"Bitte öffnen Sie den Mund."
耳,Ohr,"Mein Ohr tut weh."
上手,geschickt / gut,"Er singt gut."
手,Hand,"Bitte waschen Sie Ihre Hände."
空く,frei werden / leer werden,"Ein Sitzplatz ist frei."
男,Mann,"Ein Mann ist gekommen."
女,Frau,"Das Mädchen spielt."
子供,Kind,"Die Kinder spielen fröhlich."
大好き,lieben,"Ich liebe Hunde."
私,ich / mir,"Ich bin ein Schüler."
友達,Freund,"Ich spiele mit meinem Freund."
家,Haus,"Ich gehe nach Hause."
晴れる,aufklaren / sonnig werden,"Heute war es sonnig."
こう,so / auf diese Weise,"So wird es gut sein."
昨日,gestern,"Gestern hat es geregnet."
開く,aufgehen / öffnen (intr.),"Die Tür ist offen."
閉じる,schließen,"Bitte schließen Sie das Buch."
閉める,schließen,"Bitte schließen Sie das Fenster."
閉まる,geschlossen werden,"Die Tür ist geschlossen."
聞く,hören / fragen,"Ich höre Musik."
時間,Zeit,"Haben Sie Zeit?"
高い,hoch / teuer,"Dieses Gebäude ist sehr hoch."
くれる,geben (mir),"Ein Freund hat mir ein Buch gegeben."
安い,billig,"Das Gemüse in diesem Laden ist günstig."
低い,niedrig,"Dieser Tisch ist niedrig."
前,vorn / vorher,"Lass uns vor dem Bahnhof treffen."
後,nachher / danach,"Ich ruhe mich nach der Prüfung aus."
後ろ,hinten / hinter,"Er hat sich umgedreht."
午後,nachmittags,"Am Nachmittag gibt es ein Meeting."
午前,vormittags,"Am Vormittag gehe ich einkaufen."
朝,Morgen,"Ich esse Frühstück."
昼,Mittag,"Ich koche Mittagessen."
かなり,ziemlich,"Dieser Film ist ziemlich interessant."
晩,Abend,"Ich habe Abendessen gegessen."
今晩,heute Abend,"Ich habe heute Abend Pläne."
夜,Nacht / Abend,"Ich gehe abends spazieren."
食べる,essen,"Ich esse Frühstück."
飲む,trinken,"Ich trinke Kaffee."
ご飯,Essen / Reis,"Ich koche leckeres Essen."
買う,kaufen,"Ich kaufe Gemüse im Supermarkt."
見る,sehen / schauen,"Ich schaue gerne Fernsehen."
もっと,mehr,"Lass uns mehr üben."
見つける,finden,"Ich habe den Schlüssel gefunden."
見つかる,gefunden werden,"Mein Portemonnaie wurde gefunden."
言う,sagen,"Ich möchte etwas sagen."
話す,sprechen,"Ich spreche auf Japanisch."
読む,lesen,"Ich lese gerne Bücher."
漢字,Kanji (chinesische Schriftzeichen),"Kanji zu schreiben ist schwierig."
書く,schreiben,"Ich schreibe gerne Briefe."
覚える,merken / lernen,"Kanji zu lernen ist anstrengend."
そこ,dort / da,"Dort liegt ein Buch."
会う,treffen,"Ich treffe meinen Freund."
場合,Fall / Situation,"In diesem Fall macht man es so."
車,Auto,"Ich habe ein Auto gekauft."
電車,Zug / Bahn,"Ich fahre mit dem Zug."
駅,Bahnhof,"Ich warte am Bahnhof."
道,Weg / Straße,"Dieser Weg ist breit."
他,anderer / andere,"Ich denke über eine andere Methode nach."
止める,anhalten,"Bitte halten Sie das Auto an."
歩く,gehen / laufen,"Ich gehe im Park spazieren."
走る,rennen / laufen,"Ich laufe jeden Morgen."
近く,in der Nähe,"In der Nähe gibt es einen Supermarkt."
近い,nah,"Der Bahnhof ist nah."
遠い,weit,"Mein Haus ist weit entfernt."
長い,lang,"Ich bin einen langen Weg gelaufen."
短い,kurz,"Ich habe eine kurze Geschichte erzählt."
広い,weit / breit,"Ich wohne in einem großen Zimmer."
もらう,erhalten / bekommen,"Ich habe ein Geschenk bekommen."
全部,alles,"Ich habe alles gegessen."
国,Land / Staat,"Mein Land ist Japan."
白い,weiß,"Es gibt einen weißen Hund."
赤い,rot,"Ich habe ein rotes Auto gesehen."
米,Reis,"Ich habe Reis gekocht."
未だ,noch nicht,"Es ist noch nicht fertig."