expression,reading,sentence,sentence_kana,sentence_audio,expression_audio,image_uri,tags
点数,てんすう,今回はテストの点数が悪かった。,こんかい は てすと の てんすう が わるかった,点数_sentence.mp3,点数.mp3,,
単数,たんすう,penは単数でpensは複数です。,ぺんは たんすう で ぺんず は ふくすう です,単数_sentence.mp3,単数.mp3,,
手数,てすう,お手数ですがよろしくお願いします。,おてすう です が よろしく おねがい します,手数_sentence.mp3,手数.mp3,,
ダウン,ダウン,サーバーがダウンしています。,さーばー が だうん して います,ダウン_sentence.mp3,ダウン.mp3,,
人数,にんずう,参加者の人数を教えてください。,さんかしゃ の にんずう を おしえて ください,人数_sentence.mp3,人数.mp3,,
回り,まわり,先生の周りに集まってください。,せんせい の まわり に あつまって ください 。,回り_sentence.mp3,回り.mp3,,
回り道,まわりみち,今日は回り道して帰ろう。,きょう は まわりみち して かえろう,回り道_sentence.mp3,回り道.mp3,,
枚数,まいすう,コピーの枚数を数えてください。,こぴー の まいすう を かぞえて ください,枚数_sentence.mp3,枚数.mp3,,
負け,まけ,この勝負はあなたの負けです。,この しょうぶ は あなた の まけ です,負け_sentence.mp3,負け.mp3,,
トレーニング,トレーニング,彼は毎日トレーニングをするの。,かれ は まいにち とれーにんぐ を する の,トレーニング_sentence.mp3,トレーニング.mp3,,
負担,ふたん,交通費は個人負担です。,こうつうひ は こじん ふたん です,負担_sentence.mp3,負担.mp3,,
分担,ぶんたん,私たち夫婦は家事を分担しています。,わたしたち ふうふ は かじ を ぶんたん して います,分担_sentence.mp3,分担.mp3,,
当初,とうしょ,当初の計画ではもっと早く終わるはずでした。,とうしょ の けいかく で は もっと はやく おわる はず でした,当初_sentence.mp3,当初.mp3,,
当局,とうきょく,その事件については当局が調査しています。,その じけん に ついて は とうきょく が ちょうさ して います,当局_sentence.mp3,当局.mp3,,
当日,とうじつ,入場券は当日でも買えますよ。,にゅうじょうけん は とうじつ で も かえます よ,当日_sentence.mp3,当日.mp3,,
そっと,そっと,母親は娘の髪をそっとなでたの。,ははおや は むすめ の かみ を そっと なでた の,そっと_sentence.mp3,そっと.mp3,,
手当て,てあて,彼女は急いで怪我の手当てをしたよ。,かのじょ は いそいで けが の てあて を した よ,手当て_sentence.mp3,手当て.mp3,,
当分,とうぶん,彼女は当分学校を休むそうです。,かのじょ は とうぶん がっこう を やすむ そう です,当分_sentence.mp3,当分.mp3,,
当人,とうにん,当人は意外に平気なようね。,とうにん は いがい に へいき なよう ね 。,当人_sentence.mp3,当人.mp3,,
当番,とうばん,今日は私が掃除の当番です。,きょう は わたし が そうじ の とうばん です,当番_sentence.mp3,当番.mp3,,
日当たり,ひあたり,この部屋は日当たりがいい。,この へや は ひあたり が いい,日当たり_sentence.mp3,日当たり.mp3,,
天然,てんねん,ここは天然の温泉です。,ここ は てんねん の おんせん です,天然_sentence.mp3,天然.mp3,,
マーク,マーク,このブランドのマークは可愛いですね。,この ぶらんど の まーく は かわいい です ね,マーク_sentence.mp3,マーク.mp3,,
文法,ぶんぽう,今日は英語の文法を勉強します。,きょう は えいご の ぶんぽう を べんきょう します,文法_sentence.mp3,文法.mp3,,
法学部,ほうがくぶ,彼女は法学部の学生です。,かのじょ は ほうがくぶ の がくせい です,法学部_sentence.mp3,法学部.mp3,,
法,ほう,国民は法に従わなければならないよ。,こくみん は ほう に したがわなければ ならない よ,法_sentence.mp3,法.mp3,,
法則,ほうそく,勝利するには法則があるそうだ。,しょうり する に は ほうそく が ある そう だ,法則_sentence.mp3,法則.mp3,,
不規則,ふきそく,最近、不規則な生活をしている。,さいきん ふきそく な せいかつ を して いる,不規則_sentence.mp3,不規則.mp3,,
たった,たった,財布の中にたった1000円しかないよ。,さいふ の なか に たった せんえん しか ない よ,たった_sentence.mp3,たった.mp3,,
経る,へる,彼は新聞記者を経て作家になりました。,かれ は しんぶん きしゃ を へて さっか に なりました,経る_sentence.mp3,経る.mp3,,
有利,ゆうり,資格があると就職に有利です。,しかく が ある と しゅうしょく に ゆうり です,有利_sentence.mp3,有利.mp3,,
不利,ふり,彼は今、不利な立場にいます。,かれ は いま ふり な たちば に います,不利_sentence.mp3,不利.mp3,,
利口,りこう,あの犬はとても利口ですね。,あの いぬ は とても りこう です ね,利口_sentence.mp3,利口.mp3,,
利子,りし,借金に利子をつけて返したの。,しゃっきん に りし を つけて かえした の,利子_sentence.mp3,利子.mp3,,
たまたま,たまたま,道でたまたま友達に会った。,みち で たまたま ともだち に あった,たまたま_sentence.mp3,たまたま.mp3,,
左利き,ひだりきき,私の息子は左利きです。,わたし の むすこ は ひだりきき です,左利き_sentence.mp3,左利き.mp3,,
利益,りえき,先月の利益は200万円でした。,せんげつ の りえき は 200 まんえん でした,利益_sentence.mp3,利益.mp3,,
有益,ゆうえき,昨日の話し合いは有益でした。,きのう の はなしあい は ゆうえき でした,有益_sentence.mp3,有益.mp3,,
買収,ばいしゅう,彼は買収されたらしいわ。,かれ は ばいしゅう された らしい わ,買収_sentence.mp3,買収.mp3,,
年収,ねんしゅう,税金の額は年収によって変わります。,ぜいきん の がく は ねんしゅう に よって かわります,年収_sentence.mp3,年収.mp3,,
木造,もくぞう,隣に木造の家が建ったね。,となり に もくぞう の いえ が たった ね,木造_sentence.mp3,木造.mp3,,
テンポ,テンポ,この曲はテンポが速いですね。,この きょく は てんぽ が はやい です ね,テンポ_sentence.mp3,テンポ.mp3,,
必然,ひつぜん,私と彼が出会ったのは必然だったの。,わたし と かれ が であった の は ひつぜん だった の,必然_sentence.mp3,必然.mp3,,
要する,ようする,このビルは完成までに2年を要した。,この びる は かんせい まで に 2 ねん を ようした,要する_sentence.mp3,要する.mp3,,
不要,ふよう,不要になったパソコンを処分したんだ。,ふよう に なった ぱそこん を しょぶん した ん だ,不要_sentence.mp3,不要.mp3,,
要するに,ようするに,要するに時機を待つべきだ。,ようするに じき を まつべき だ,要するに_sentence.mp3,要するに.mp3,,
不必要,ふひつよう,不必要なファイルは削除してください。,ふひつよう な ふぁいる は さくじょ して ください,不必要_sentence.mp3,不必要.mp3,,
プラン,プラン,彼女と旅行のプランを考えました。,かのじょ と りょこう の ぷらん を かんがえました,プラン_sentence.mp3,プラン.mp3,,
要点,ようてん,話の要点だけ教えてください。,はなし の ようてん だけ おしえて ください,要点_sentence.mp3,要点.mp3,,
求める,もとめる,子供は親の愛を求めます。,こども は おや の あい を もとめます,求める_sentence.mp3,求める.mp3,,
要請,ようせい,その国の政府は各国に支援を要請したのよ。,その くに の せいふ は かっこく に しえん を ようせい した の よ,要請_sentence.mp3,要請.mp3,,
計る,はかる,100メートル走のタイムを計ったんだ。,100 めーとるそう の たいむ を はかった ん だ,計る_sentence.mp3,計る.mp3,,
ほっと,ほっと,家に着いてほっとしたよ。,いえ に ついて ほっと した よ,ほっと_sentence.mp3,ほっと.mp3,,
体温計,たいおんけい,体温計が壊れてしまった。,たいおんけい が こわれて しまった,体温計_sentence.mp3,体温計.mp3,,
日差し,ひざし,今日は日差しが強いですね。,きょう は ひざし が つよい です ね,日差し_sentence.mp3,日差し.mp3,,
物差し,ものさし,30センチの物差しをください。,30 せんち の ものさし を ください,物差し_sentence.mp3,物差し.mp3,,
役割,やくわり,みんなで役割を分担しましょう。,みんな で やくわり を ぶんたん しましょう,役割_sentence.mp3,役割.mp3,,
割合,わりあい,二つの薬品を1対3の割合で混ぜたんだ。,ふたつ の やくひん を 1 たい 3 の わりあい で まぜた ん だ,割合_sentence.mp3,割合.mp3,,
なるほど,なるほど,なるほど、よく分かりました。,なるほど よく わかりました,なるほど_sentence.mp3,なるほど.mp3,,
割り当て,わりあて,チケットの割り当ては1人10枚です。,ちけっと の わりあて は ひとり じゅうまい です,割り当て_sentence.mp3,割り当て.mp3,,
割り当てる,わりあてる,全員に作業が割り当てられました。,ぜんいん に さぎょう が わりあてられました,割り当てる_sentence.mp3,割り当てる.mp3,,
割り引く,わりびく,定価から2000円割り引きますよ。,ていか から 2 せんえん わりびきます よ,割り引く_sentence.mp3,割り引く.mp3,,
割に,わりに,この映画は割に面白いわ。,この えいが は わりに おもしろい わ,割に_sentence.mp3,割に.mp3,,
割り,わり,3日に1度の割りで彼からメールが来るの。,みっか に 1 ど の わり で かれ から めーる が くる の,割り_sentence.mp3,割り.mp3,,
割り引き,わりびき,今日は全品10%割り引きです。,きょう は ぜんぴん 10% わりびき です,割り引き_sentence.mp3,割り引き.mp3,,
バイト,バイト,今日は6時からバイトです。,きょう は 6 じ から ばいと です,バイト_sentence.mp3,バイト.mp3,,
割合に,わりあいに,今回のテストは割合に簡単でした。,こんかい の てすと は わりあいに かんたん でした,割合に_sentence.mp3,割合に.mp3,,
残り,のこり,仕事の残りは家でします。,しごと の のこり は いえ で します,残り_sentence.mp3,残り.mp3,,
残らず,のこらず,ゴミを残らず拾ったよ。,ごみ を のこらず ひろった よ,残らず_sentence.mp3,残らず.mp3,,
払い,はらい,飲み屋の払いがたまっているんだ。,のみや の はらい が たまって いる ん だ,払い_sentence.mp3,払い.mp3,,
引き返す,ひきかえす,雨が強かったので引き返したよ。,あめ が つよかった の で ひきかえした よ,引き返す_sentence.mp3,引き返す.mp3,,
ぶつける,ぶつける,車を壁にぶつけてしまいました。,くるま を かべ に ぶつけて しまいました,ぶつける_sentence.mp3,ぶつける.mp3,,
取り返す,とりかえす,彼はチャンピオンのタイトルを取り返したね。,かれ は ちゃんぴおん の たいとる を とりかえした ね,取り返す_sentence.mp3,取り返す.mp3,,
申し出る,もうしでる,彼はプロジェクトへの参加を申し出たよ。,かれ は ぷろじぇくと へ の さんか を もうしでた よ,申し出る_sentence.mp3,申し出る.mp3,,
申し上げる,もうしあげる,結果を申し上げます。,けっか を もうしあげます,申し上げる_sentence.mp3,申し上げる.mp3,,
申す,もうす,私は鈴木と申します。,わたくし は すずき と もうします,申す_sentence.mp3,申す.mp3,,
持ち込む,もちこむ,機内に荷物を持ち込んだの。,きない に にもつ を もちこんだ の,持ち込む_sentence.mp3,持ち込む.mp3,,
タイヤ,タイヤ,車のタイヤを換えた。,くるま の たいや を かえた,タイヤ_sentence.mp3,タイヤ.mp3,,
見込み,みこみ,3月に大学を卒業の見込みです。,3 がつ に だいがく を そつぎょう の みこみ です,見込み_sentence.mp3,見込み.mp3,,
申し込み,もうしこみ,今日、スポーツジムの申し込みをしました。,きょう すぽーつじむ の もうしこみ を しました,申し込み_sentence.mp3,申し込み.mp3,,
払い込む,はらいこむ,授業料を学校に払い込みました。,じゅぎょうりょう を がっこう に はらいこみました,払い込む_sentence.mp3,払い込む.mp3,,
飲み込む,のみこむ,彼は薬を一気に飲み込んだ。,かれ は くすり を いっきに のみこんだ,飲み込む_sentence.mp3,飲み込む.mp3,,
割り込む,わりこむ,車が前に割り込んできた。,くるま が まえ に わりこんで きた,割り込む_sentence.mp3,割り込む.mp3,,
引っ込む,ひっこむ,ダイエットをしてお腹が引っ込みました。,だいえっと を して おなか が ひっこみました,引っ込む_sentence.mp3,引っ込む.mp3,,
マイク,マイク,彼女はマイクを持って話し始めたの。,かのじょ は まいく を もって はなしはじめた の,マイク_sentence.mp3,マイク.mp3,,
人込み,ひとごみ,私は人込みが好きではありません。,わたし は ひとごみ が すき で は ありません,人込み_sentence.mp3,人込み.mp3,,
長期,ちょうき,今回は長期の滞在です。,こんかい は ちょうき の たいざい です,長期_sentence.mp3,長期.mp3,,
短期,たんき,明日から2週間、短期のアルバイトをします。,あした から 2 しゅうかん たんき の あるばいと を します,短期_sentence.mp3,短期.mp3,,
短期大学,たんきだいがく,彼女は短期大学で日本文学を勉強しました。,かのじょ は たんきだいがく で にほん ぶんがく を べんきょう しました,短期大学_sentence.mp3,短期大学.mp3,,
有限,ゆうげん,宇宙は有限だと思いますか。,うちゅう は ゆうげん だ と おもいます か,有限_sentence.mp3,有限.mp3,,
ゆとり,ゆとり,最近、生活にゆとりがでてきました。,さいきん せいかつ に ゆとり が でて きました,ゆとり_sentence.mp3,ゆとり.mp3,,
無限,むげん,資源は無限ではありません。,しげん は むげん で は ありません,無限_sentence.mp3,無限.mp3,,
無制限,むせいげん,このサイトでは音楽を無制限でダウンロードできる。,この さいと で は おんがく を むせいげん で だうんろーど できる,無制限_sentence.mp3,無制限.mp3,,
値切る,ねぎる,彼は値切るのが上手です。,かれ は ねぎる の が じょうず です,値切る_sentence.mp3,値切る.mp3,,
前売り券,まえうりけん,コンサートの前売り券を手に入れたんだ。,こんさーと の まえうりけん を て に いれた ん だ,前売り券_sentence.mp3,前売り券.mp3,,
年代,ねんだい,私と彼は同じ年代です。,わたし と かれ は おなじ ねんだい です,年代_sentence.mp3,年代.mp3,,
ぼんやり,ぼんやり,彼は遠くをぼんやり見ていたの。,かれ は とおく を ぼんやり みて いた の,ぼんやり_sentence.mp3,ぼんやり.mp3,,
代金,だいきん,ここで代金をお支払いください。,ここ で だいきん を お しはらい ください,代金_sentence.mp3,代金.mp3,,
目指す,めざす,私は料理人を目指しています。,わたし は りょうりにん を めざして います,目指す_sentence.mp3,目指す.mp3,,
指差す,ゆびさす,みんなが彼の指差す方を見たんだ。,みんな が かれ の ゆびさす ほう を みたんだ,指差す_sentence.mp3,指差す.mp3,,
人差し指,ひとさしゆび,彼女は人差し指を怪我したの。,かのじょ は ひとさしゆび を けが した の 。,人差し指_sentence.mp3,人差し指.mp3,,
中指,なかゆび,中指をドアに挟んでしまった。,なかゆび を どあ に はさんで しまった,中指_sentence.mp3,中指.mp3,,
定年,ていねん,彼は来年定年を迎える。,かれ は らいねん ていねん を むかえる,定年_sentence.mp3,定年.mp3,,
たまらない,たまらない,頭が痛くてたまらない。,あたま が いたくて たまらない,たまらない_sentence.mp3,たまらない.mp3,,
不安定,ふあんてい,最近、体調が少し不安定です。,さいきん たいちょう が すこし ふあんてい です,不安定_sentence.mp3,不安定.mp3,,
定員,ていいん,降りてください、定員オーバーです。,おりて ください ていいん おーばー です,定員_sentence.mp3,定員.mp3,,
定期,ていき,定期演奏会は年に4回あります。,ていきえんそうかい は ねん に 4 かい あります,定期_sentence.mp3,定期.mp3,,
定価,ていか,この本の定価は525円です。,この ほん の ていか は 525 えん です,定価_sentence.mp3,定価.mp3,,
未定,みてい,この件の担当者は未定です。,この けん の たんとうしゃ は みてい です,未定_sentence.mp3,未定.mp3,,
モーター,モーター,車のモーターを修理したぜ！,くるま の もーたー を しゅうり した ぜ,モーター_sentence.mp3,モーター.mp3,,
定食,ていしょく,昼の定食は3種類あります。,ひる の ていしょく は 3 しゅるい あります,定食_sentence.mp3,定食.mp3,,
定休日,ていきゅうび,この店は水曜が定休日です。,この みせ は すいよう が ていきゅうび です,定休日_sentence.mp3,定休日.mp3,,
予算,よさん,車の費用、予算オーバーだ。,くるま の ひよう、 よさん おーばー だ,予算_sentence.mp3,予算.mp3,,
予報,よほう,予報では明日は雨ですね。,よほう で は あした は あめ です ね,予報_sentence.mp3,予報.mp3,,
予言,よげん,彼の予言は当たったことがないね。,かれ の よげん は あたった こと が ない ね,予言_sentence.mp3,予言.mp3,,
まして,まして,他人でも悲しいのだから、まして本人はどれほどでしょう。,たにん で も かなしい の だ から まして ほんにん は どれほど でしょう,まして_sentence.mp3,まして.mp3,,
束,たば,これは一束で300円です。,これ は ひとたば で 300 えん です,束_sentence.mp3,束.mp3,,
花束,はなたば,卒業式に花束をもらいました。,そつぎょうしき に はなたば を もらいました,花束_sentence.mp3,花束.mp3,,
変更,へんこう,予定が変更になりました。,よてい が へんこう に なりました,変更_sentence.mp3,変更.mp3,,
夜更かし,よふかし,最近の子供たちは夜更かしです。,さいきん の こども たち は よふかし です,夜更かし_sentence.mp3,夜更かし.mp3,,
増す,ます,大雨で川の水かさが増しているな。,おおあめ で かわ の みずかさ が まして いる な,増す_sentence.mp3,増す.mp3,,
ピストル,ピストル,犯人はピストルを持っているわ。,はんにん は ぴすとる を もって いる わ,ピストル_sentence.mp3,ピストル.mp3,,
増大,ぞうだい,生産コスト増大のため、値上げします。,せいさん こすと ぞうだい の ため ねあげ します,増大_sentence.mp3,増大.mp3,,
増減,ぞうげん,この数年、体重は増減していません。,この すうねん たいじゅう は ぞうげん して いません,増減_sentence.mp3,増減.mp3,,
乗り出す,のりだす,船が長い航海に乗り出したの。,ふね が ながい こうかい に のりだした の,乗り出す_sentence.mp3,乗り出す.mp3,,
乗り込む,のりこむ,あの駅で学生がたくさん乗り込んだね。,あの えき で がくせい が たくさん のりこんだ ね,乗り込む_sentence.mp3,乗り込む.mp3,,
乗り降り,のりおり,この駅でたくさんの人が乗り降りしますね。,この えき で たくさん の ひと が のりおり します ね,乗り降り_sentence.mp3,乗り降り.mp3,,
着ける,つける,玄関に車を着けます。,げんかん に くるま を つけます,着ける_sentence.mp3,着ける.mp3,,
たっぷり,たっぷり,たっぷりとマッサージしてもらいました。,たっぷり と まっさーじ して もらいました,たっぷり_sentence.mp3,たっぷり.mp3,,
水着,みずぎ,水着に着替えました。,みずぎ に きがえました,水着_sentence.mp3,水着.mp3,,
役立つ,やくだつ,学校で勉強したことが役立った。,がっこう で べんきょう した こと が やくだった,役立つ_sentence.mp3,役立つ.mp3,,
立ち上がる,たちあがる,彼は急に立ち上がったの。,かれ は きゅう に たちあがった の,立ち上がる_sentence.mp3,立ち上がる.mp3,,
中立,ちゅうりつ,私は中立の立場を取っています。,わたし は ちゅうりつ の たちば を とって います,中立_sentence.mp3,中立.mp3,,
都立,とりつ,ここは都立の病院です。,ここ は とりつ の びょういん です,都立_sentence.mp3,都立.mp3,,
つくづく,つくづく,来てよかったとつくづく思います。,きて よかったと つくづく おもいます,つくづく_sentence.mp3,つくづく.mp3,,
立て込む,たてこむ,この辺は住宅が立て込んで います。,このへん は じゅうたく が たてこんで います,立て込む_sentence.mp3,立て込む.mp3,,
夕立,ゆうだち,帰宅中、夕立にあったの。,きたくちゅう ゆうだち に あった の,夕立_sentence.mp3,夕立.mp3,,
立ち止まる,たちどまる,人々は立ち止まって上を見上げたの。,ひとびと は たちどまって うえ を みあげた の,立ち止まる_sentence.mp3,立ち止まる.mp3,,
着席,ちゃくせき,みなさん、着席してください。,みなさん ちゃくせき して ください,着席_sentence.mp3,着席.mp3,,
次々に,つぎつぎに,走者が次々にゴールしました。,そうしゃ が つぎつぎに ごーる しました,次々に_sentence.mp3,次々に.mp3,,
どうせ,どうせ,どうせ間に合わないならゆっくり行こう。,どうせ まにあわない なら ゆっくり いこう,どうせ_sentence.mp3,どうせ.mp3,,Tonari no Totoro
次ぐ,つぐ,彼はトップに次ぐ好成績でした。,かれ は とっぷ に つぐ こうせいせき でした,次ぐ_sentence.mp3,次ぐ.mp3,,
取り次ぐ,とりつぐ,電話があったら取り次いでください。,でんわ が あったら とりついで ください,取り次ぐ_sentence.mp3,取り次ぐ.mp3,,
目次,もくじ,読みたい章を目次で探しました。,よみたい しょう を もくじ で さがしました,目次_sentence.mp3,目次.mp3,,
不運,ふうん,彼に不運な出来事が起こったの。,かれ に ふうん な できごと が おこった の,不運_sentence.mp3,不運.mp3,,
動向,どうこう,今、経済の動向は読みにくいわ。,いま けいざい の どうこう は よみ にくい わ,動向_sentence.mp3,動向.mp3,,
動作,どうさ,彼は動作が機敏です。,かれ は どうさ が きびん です,動作_sentence.mp3,動作.mp3,,
リズム,リズム,最近彼は生活のリズムが乱れています。,さいきん かれ は せいかつ の りずむ が みだれて います,リズム_sentence.mp3,リズム.mp3,,
動力,どうりょく,この車の動力は電気です。,この くるま の どうりょく は でんき です,動力_sentence.mp3,動力.mp3,,
働き,はたらき,部下が素晴らしい働きをしたな。,ぶか が すばらしい はたらき を した な,働き_sentence.mp3,働き.mp3,,
早朝,そうちょう,私は早朝のジョギングを日課にしています。,わたし は そうちょう の じょぎんぐ を にっか に して います,早朝_sentence.mp3,早朝.mp3,,
早める,はやめる,集合時間を30分早めました。,しゅうごうじかん を 30 ぷん はやめました,早める_sentence.mp3,早める.mp3,,
早まる,はやまる,早まらないでよく考えましょう。,はやまらない で よく かんがえましょう,早まる_sentence.mp3,早まる.mp3,,
ハンドル,ハンドル,この車は左ハンドルです。,この くるま は ひだり はんどる です,ハンドル_sentence.mp3,ハンドル.mp3,,
速度,そくど,新幹線の速度はどれくらいですか。,しんかんせん の そくど は どれ くらい です か,速度_sentence.mp3,速度.mp3,,
速達便,そくたつびん,速達便なら明日の午前中に届きます。,そくたつびん なら あした の ごぜんちゅう に とどきます,速達便_sentence.mp3,速達便.mp3,,
