expression,reading,sentence,sentence_kana,sentence_audio,expression_audio,image_uri,tags
暖房,だんぼう,冬は暖房が必要です。,ふゆ は だんぼう が ひつよう です,暖房_sentence.mp3,暖房.mp3,,
文房具,ぶんぼうぐ,新しい文房具を買いました。,あたらしい ぶんぼうぐ を かいました,文房具_sentence.mp3,文房具.mp3,,
パジャマ,ぱじゃま,このパジャマを着て。,この ぱじゃま を きて,パジャマ_sentence.mp3,パジャマ.mp3,,
諸国,しょこく,彼はヨーロッパ諸国を旅行した。,かれ は よーろっぱ しょこく を りょこう した,諸国_sentence.mp3,諸国.mp3,,
緑色,みどりいろ,彼は緑色のジャケットを着ています。,かれ は みどりいろ の じゃけっと を きて います,緑色_sentence.mp3,緑色.mp3,,
貿易,ぼうえき,父は貿易の仕事をしています。,ちち は ぼうえき の しごと を して います,貿易_sentence.mp3,貿易.mp3,,
輸入,ゆにゅう,これはイタリアから輸入した服です。,これ は いたりあ から ゆにゅう した ふく です,輸入_sentence.mp3,輸入.mp3,,
ボールペン,ぼーるぺん,ボールペンで名前を書いてください。,ぼーるぺん で なまえ を かいて ください,ボールペン_sentence.mp3,ボールペン.mp3,,
輸出,ゆしゅつ,彼の会社は車を輸出しています。,かれ の かいしゃ は くるま を ゆしゅつ して います,輸出_sentence.mp3,輸出.mp3,,
指輪,ゆびわ,彼女に指輪をプレゼントしました。,かのじょ に ゆびわ を ぷれぜんと しました,指輪_sentence.mp3,指輪.mp3,,
往復,おうふく,往復切符をください。,おうふく きっぷ を ください,往復_sentence.mp3,往復.mp3,,
復習,ふくしゅう,昨日の復習をしましたか。,きのう の ふくしゅう を しました か,復習_sentence.mp3,復習.mp3,,
すいか,すいか,夏はすいかが美味しい。,なつ は すいか が おいしい,すいか_sentence.mp3,すいか.mp3,,
繰り返す,くりかえす,彼女は同じ間違いを繰り返した。,かのじょ は おなじ まちがい を くりかえした,繰り返す_sentence.mp3,繰り返す.mp3,,
留学,りゅうがく,1年間、アメリカに留学しました。,いちねんかん あめりか に りゅうがく しました,留学_sentence.mp3,留学.mp3,,
停留所,ていりゅうじょ,バスの停留所で10分待ちました。,ばす の ていりゅうじょ で じゅっぷん まちました,停留所_sentence.mp3,停留所.mp3,,
書留,かきとめ,これを書留で送りたいのですが。,これ を かきとめ で おくりたい の です が,書留_sentence.mp3,書留.mp3,,
そちら,そちら,夕方そちらに着きます。,ゆうがた そちら に つきます,そちら_sentence.mp3,そちら.mp3,,
守る,まもる,彼は約束を守る人です。,かれ は やくそく を まもる ひと です,守る_sentence.mp3,守る.mp3,,
留守,るす,父は今、留守です。,ちち は いま るす です,留守_sentence.mp3,留守.mp3,,Tonari no Totoro
住宅,じゅうたく,ここは静かな住宅地だ。,ここ は しずかな じゅうたくち だ,住宅_sentence.mp3,住宅.mp3,,
自宅,じたく,自宅に電話を下さい。,じたく に でんわ を ください,自宅_sentence.mp3,自宅.mp3,,
お宅,おたく,先生のお宅はどちらですか。,せんせい の おたく は どちら です か,お宅_sentence.mp3,お宅.mp3,,
早起き,はやおき,祖父は早起きです。,そふ は はやおき です,早起き_sentence.mp3,早起き.mp3,,
昼寝,ひるね,私の子供は毎日昼寝をします。,わたし の こども は まいにち ひるね を します,昼寝_sentence.mp3,昼寝.mp3,,
静か,しずか,今年の夏休みには静かな所へ行きたい。,ことし の なつやすみ に は しずか な ところ へ いきたい,静か_sentence.mp3,静か.mp3,,
どっち,どっち,どっちの色が好きですか。,どっち の いろ が すき です か 。,どっち_sentence.mp3,どっち.mp3,,
暇,ひま,明日は暇ですか。,あした は ひま です か,暇_sentence.mp3,暇.mp3,,
趣味,しゅみ,私の趣味は映画とテニスです。,わたし の しゅみ は えいが と てにす です,趣味_sentence.mp3,趣味.mp3,,
両方,りょうほう,チョコレートとケーキを両方ください。,ちょこれーと と けーき を りょうほう ください,両方_sentence.mp3,両方.mp3,,
両替,りょうがえ,1万円を両替してください。,いちまんえん を りょうがえ して ください,両替_sentence.mp3,両替.mp3,,
バスケットボール,ばすけっとぼーる,姉はバスケットボールの選手です。,あね は ばすけっとぼーる の せんしゅ です,バスケットボール_sentence.mp3,バスケットボール.mp3,,
両親,りょうしん,私の両親は大阪に住んでいます。,わたし の りょうしん は おおさか に すんで います,両親_sentence.mp3,両親.mp3,,
片道,かたみち,東京まで片道切符を買った。,とうきょう まで かたみち きっぷ を かった,片道_sentence.mp3,片道.mp3,,
内側,うちがわ,白線の内側に下がってください。,はくせん の うちがわ に さがって ください,内側_sentence.mp3,内側.mp3,,
向こう側,むこうがわ,私の家は川の向こう側にあります。,わたし の いえ は かわ の むこうがわ に あります,向こう側_sentence.mp3,向こう側.mp3,,
サンドイッチ,さんどいっち,今日のお昼はサンドイッチです。,きょう の おひる は さんどいっち です,サンドイッチ_sentence.mp3,サンドイッチ.mp3,,
外側,そとがわ,白線の外側を歩かないでください。,はくせん の そとがわ を あるかない で ください,外側_sentence.mp3,外側.mp3,,
左側,ひだりがわ,画面の左側を見てください。,がめん の ひだりがわ を みて ください,左側_sentence.mp3,左側.mp3,,
右側,みぎがわ,彼女はいつも私の右側を歩きます。,かのじょ は いつも わたし の みぎがわ を あるきます,右側_sentence.mp3,右側.mp3,,
にこにこ,にこにこ,彼女はいつもにこにこしています。,かのじょ は いつも にこにこ して います,にこにこ_sentence.mp3,にこにこ.mp3,,Tonari no Totoro
裏返す,うらがえす,彼は紙を裏返しました。,かれ は かみ を うらがえしました,裏返す_sentence.mp3,裏返す.mp3,,
週刊誌,しゅうかんし,その週刊誌はゴシップばかりだ。,その しゅうかんし は ごしっぷ ばかり だ,週刊誌_sentence.mp3,週刊誌.mp3,,
朝刊,ちょうかん,今日の朝刊に面白い記事があった。,きょう の ちょうかん に おもしろい きじ が あった,朝刊_sentence.mp3,朝刊.mp3,,
夕刊,ゆうかん,そのニュースは夕刊で見ました。,その にゅーす は ゆうかん で みました,夕刊_sentence.mp3,夕刊.mp3,,
ウール,うーる,このウールのセーターは暖かい。,この うーる の せーたー は あたたかい,ウール_sentence.mp3,ウール.mp3,,
詳しい,くわしい,もっと詳しく説明してください。,もっと くわしく せつめい して ください,詳しい_sentence.mp3,詳しい.mp3,,
細かい,こまかい,彼女は細かいことにうるさい。,かのじょ は こまかい こと に うるさい,細かい_sentence.mp3,細かい.mp3,,
細か,こまか,それは細かな問題です。,それ は こまか な もんだい です,細か_sentence.mp3,細か.mp3,,
積もる,つもる,雪が積もっています。,ゆき が つもって います,積もる_sentence.mp3,積もる.mp3,,
コーラ,こーら,私の兄はコーラが好きだ。,わたし の あに は こーら が すき だ,コーラ_sentence.mp3,コーラ.mp3,,
訳,やく,そんな訳で、私は仕事を辞めました。,そんな わけ で わたし は しごと を やめました,訳_sentence.mp3,訳.mp3,,
訳す,やくす,この文を訳してください。,この ぶん を やくして ください,訳す_sentence.mp3,訳す.mp3,,
検討,けんとう,今日中にこの問題を検討してください。,きょう じゅう に この もんだい を けんとう して ください,検討_sentence.mp3,検討.mp3,,
塗る,ぬる,壁にペンキを塗っています。,かべ に ぺんき を ぬって います,塗る_sentence.mp3,塗る.mp3,,
トイレットペーパー,といれっとぺーぱー,トイレットペーパーを交換しました。,といれっとぺーぱー を こうかん しました,トイレットペーパー_sentence.mp3,トイレットペーパー.mp3,,
付く,つく,靴に泥が付いています。,くつ に どろ が ついて います,付く_sentence.mp3,付く.mp3,,
付ける,つける,おまけを付けました。,おまけ を つけました,付ける_sentence.mp3,付ける.mp3,,
受け付ける,うけつける,郵便物は5時まで受け付けています。,ゆうびんぶつ は ごじ まで うけつけて います,受け付ける_sentence.mp3,受け付ける.mp3,,
片付ける,かたづける,早く部屋を片付けなさい。,はやく へや を かたづけなさい,片付ける_sentence.mp3,片付ける.mp3,,
どなた,どなた,失礼ですが、どなたですか。,しつれい です が 、 どなた です か 。,どなた_sentence.mp3,どなた.mp3,,Tonari no Totoro
受付,うけつけ,受付は9時からです。,うけつけ は くじ から です,受付_sentence.mp3,受付.mp3,,
近付く,ちかづく,女性が近付いてきました。,じょせい が ちかづいて きました,近付く_sentence.mp3,近付く.mp3,,
片付く,かたづく,仕事が大分片付いた。,しごと が だいぶ かたづいた,片付く_sentence.mp3,片付く.mp3,,
気を付ける,きをつける,体に気を付けてください。,からだ に き を つけて ください,気を付ける_sentence.mp3,気を付ける.mp3,,
ハイキング,はいきんぐ,昨日は友人とハイキングに行きました。,きのう は ゆうじん と はいきんぐ に いきました,ハイキング_sentence.mp3,ハイキング.mp3,,
貼る,はる,机にシールを貼った。,つくえ に しーる を はった,貼る_sentence.mp3,貼る.mp3,,
記念日,きねんび,今日は両親の結婚記念日です。,きょう は りょうしん の けっこん きねんび です,記念日_sentence.mp3,記念日.mp3,,
残念,ざんねん,その試合は残念な結果になった。,その しあい は ざんねん な けっか に なった,残念_sentence.mp3,残念.mp3,,
例えば,たとえば,例えば、このソフトで日本語を勉強することができます。,たとえば この そふと で にほんご を べんきょう する こと が できます,例えば_sentence.mp3,例えば.mp3,,
ハム,はむ,ハムサンドをください。,はむ さんど を ください,ハム_sentence.mp3,ハム.mp3,,
例文,れいぶん,例文を3つ作ってください。,れいぶん を みっつ つくって ください,例文_sentence.mp3,例文.mp3,,
例,れい,一つ例をあげてください。,ひとつ れい を あげて ください,例_sentence.mp3,例.mp3,,
余る,あまる,夕食の料理がたくさん余った。,ゆうしょく の りょうり が たくさん あまった,余る_sentence.mp3,余る.mp3,,Tonari no Totoro
除く,のぞく,部長を除く全員が土曜日も働いた。,ぶちょう を のぞく ぜんいん が どようび も はたらいた,除く_sentence.mp3,除く.mp3,,
ボーイフレンド,ぼーいふれんど,私のボーイフレンドはハンサムな方でした。,わたし の ぼーいふれんど は はんさむな かた でした,ボーイフレンド_sentence.mp3,ボーイフレンド.mp3,,
削る,けずる,彼は家族のために仕事の時間を削った。,かれ は かぞく の ため に しごと の じかん を けずった,削る_sentence.mp3,削る.mp3,,
遅刻,ちこく,遅刻しないでください。,ちこく しない で ください,遅刻_sentence.mp3,遅刻.mp3,,
緩い,ゆるい,このズボンは緩いです。,この ずぼん は ゆるい です,緩い_sentence.mp3,緩い.mp3,,
苦しい,くるしい,食べ過ぎておなかが苦しい。,たべすぎて おなか が くるしい,苦しい_sentence.mp3,苦しい.mp3,,
アイロン,あいろん,彼女はシャツにアイロンをかけた。,かのじょ は しゃつ に あいろん を かけた,アイロン_sentence.mp3,アイロン.mp3,,
苦い,にがい,私は苦いコーヒーが好きです。,わたし は にがい こーひー が すき です,苦い_sentence.mp3,苦い.mp3,,
苦手,にがて,私は料理が苦手です。,わたし は りょうり が にがて です,苦手_sentence.mp3,苦手.mp3,,
困る,こまる,ケータイをなくして困っています。,けーたい を なくして こまって います,困る_sentence.mp3,困る.mp3,,Tonari no Totoro
貧乏,びんぼう,彼は昔は貧乏だった。,かれ は むかし は びんぼう だった,貧乏_sentence.mp3,貧乏.mp3,,
カレーライス,カレーライス,子供はカレーライスが好きです。,こども は かれーらいす が すき です,カレーライス_sentence.mp3,カレーライス.mp3,,
不幸,ふこう,彼女の家族に不幸があった。,かのじょ の かぞく に ふこう が あった,不幸_sentence.mp3,不幸.mp3,,
幸せ,しあわせ,良い友達がいて私は幸せだ。,いい ともだち が いて わたし は しあわせ だ,幸せ_sentence.mp3,幸せ.mp3,,
塩,しお,もうちょっと塩を入れて。,もう ちょっと しお を いれて,塩_sentence.mp3,塩.mp3,,
塩辛い,しおからい,海の水は塩辛い。,うみ の みず は しおからい,塩辛い_sentence.mp3,塩辛い.mp3,,
キャッシュカード,キャッシュカード,キャッシュカードでお金を下ろした。,きゃっしゅかーど で おかね を おろした,キャッシュカード_sentence.mp3,キャッシュカード.mp3,,
砂糖,さとう,コーヒーに砂糖は入れますか。,こーひー に さとう は いれます か,砂糖_sentence.mp3,砂糖.mp3,,
規模,きぼ,この動物園は日本一の規模です。,この どうぶつえん は にっぽんいち の きぼ です,規模_sentence.mp3,規模.mp3,,
農業,のうぎょう,私は農業を勉強しています。,わたし は のうぎょう を べんきょう して います,農業_sentence.mp3,農業.mp3,,
濃い,こい,私は濃い味が好きだ。,わたし は こい あじ が すき だ,濃い_sentence.mp3,濃い.mp3,,
イヤリング,イヤリング,彼女はすてきなイヤリングをしている。,かのじょ は すてき な いやりんぐ を して いる,イヤリング_sentence.mp3,イヤリング.mp3,,
薄い,うすい,この電子辞書はとても薄い。,この でんし じしょ は とても うすい,薄い_sentence.mp3,薄い.mp3,,
厚い,あつい,その辞書はとても厚い。,その じしょ は とても あつい,厚い_sentence.mp3,厚い.mp3,,
厚さ,あつさ,私は板の厚さを測った。,わたし は いた の あつさ を はかった,厚さ_sentence.mp3,厚さ.mp3,,
迫る,せまる,締め切りが迫っています。,しめきり が せまって います,迫る_sentence.mp3,迫る.mp3,,
ガールフレンド,ガールフレンド,昔は彼女のことをガールフレンドと言っていました。,むかし は かのじょ の こと を がーるふれんど と いって いました,ガールフレンド_sentence.mp3,ガールフレンド.mp3,,
伸びる,のびる,髪がだいぶ伸びたね。,かみ が だいぶ のびた ね,伸びる_sentence.mp3,伸びる.mp3,,
越える,こえる,私たちは高い山を越えました。,わたしたち は たかい やま を こえました,越える_sentence.mp3,越える.mp3,,
カセットテープ,カセットテープ,昔はカセットテープを使っていました。,むかし は かせっとてーぷ を つかっていました 。,カセットテープ_sentence.mp3,カセットテープ.mp3,,
追い越す,おいこす,大きなトラックが私たちを追い越した。,おおき な とらっく が わたしたち を おいこした,追い越す_sentence.mp3,追い越す.mp3,,
上昇,じょうしょう,地球の気温は上昇している。,ちきゅう の きおん は じょうしょう して いる,上昇_sentence.mp3,上昇.mp3,,
改札口,かいさつぐち,改札口で会いましょう。,かいさつぐち で あいましょう,改札口_sentence.mp3,改札口.mp3,,
失礼,しつれい,ではそろそろ失礼します。,では そろそろ しつれい します,失礼_sentence.mp3,失礼.mp3,,
かゆい,かゆい,背中がかゆいです。,せなか が かゆい です,かゆい_sentence.mp3,かゆい.mp3,,
お礼,おれい,彼女にお礼の手紙を書きました。,かのじょ に おれい の てがみ を かきました,お礼_sentence.mp3,お礼.mp3,,Tonari no Totoro
謝る,あやまる,彼は直ぐに謝りました。,かれ は すぐ に あやまりました,謝る_sentence.mp3,謝る.mp3,,
注射,ちゅうしゃ,彼は注射があまり好きではありません。,かれ は ちゅうしゃ が あまり すき で は ありません,注射_sentence.mp3,注射.mp3,,
程度,ていど,この程度の怪我なら大丈夫です。,この ていど の けが なら だいじょうぶ です,程度_sentence.mp3,程度.mp3,,
ぐらぐら,ぐらぐら,地震で家がぐらぐらと揺れた。,じしん で いえ が ぐらぐら と ゆれた,ぐらぐら_sentence.mp3,ぐらぐら.mp3,,
誘う,さそう,彼女をデートに誘った。,かのじょ を でーと に さそった,誘う_sentence.mp3,誘う.mp3,,
導入,どうにゅう,会社で新しいシステムを導入した。,かいしゃ で あたらしい しすてむ を どうにゅう した,導入_sentence.mp3,導入.mp3,,
努力,どりょく,もっと努力しよう。,もっと どりょく しよう,努力_sentence.mp3,努力.mp3,,
怒る,おこる,彼女が嘘をついたので、彼は怒った。,かのじょ が うそ を ついた の で かれ は おこった,怒る_sentence.mp3,怒る.mp3,,Tonari no Totoro
ジャム,ジャム,このイチゴでジャムを作りましょう。,この いちご で じゃむ を つくりましょう,ジャム_sentence.mp3,ジャム.mp3,,
独身,どくしん,私の兄はまだ独身です。,わたし の あに は まだ どくしん です,独身_sentence.mp3,独身.mp3,,
占める,しめる,私に届くメールのうち、迷惑メールが7割を占めている。,わたし に とどく めーる の うち めいわく めーる が ななわり を しめて いる,占める_sentence.mp3,占める.mp3,,
処理,しょり,事務的な処理に1週間かかります。,じむてき な しょり に いっしゅうかん かかります,処理_sentence.mp3,処理.mp3,,
紹介,しょうかい,両親に彼女を紹介した。,りょうしん に かのじょ を しょうかい した,紹介_sentence.mp3,紹介.mp3,,
スリッパ,スリッパ,スリッパをはいてください。,すりっぱ を はいて ください,スリッパ_sentence.mp3,スリッパ.mp3,,
招く,まねく,両親を食事に招いた。,りょうしん を しょくじ に まねいた,招く_sentence.mp3,招く.mp3,,
招待,しょうたい,高校の時の先生を結婚式に招待した。,こうこう の とき の せんせい を けっこんしき に しょうたい した,招待_sentence.mp3,招待.mp3,,
夫婦,ふうふ,その夫婦はとても仲がいい。,その ふうふ は とても なか が いい,夫婦_sentence.mp3,夫婦.mp3,,
奥,おく,はさみは机の奥にあった。,はさみ は つくえ の おく に あった,奥_sentence.mp3,奥.mp3,,
トランプ,トランプ,友達とトランプをして遊びました。,ともだち と とらんぷ を して あそびました,トランプ_sentence.mp3,トランプ.mp3,,
奥さん,おくさん,彼の奥さんはきれいな方です。,かれ の おくさん は きれい な かた です,奥さん_sentence.mp3,奥さん.mp3,,
皆さん,みなさん,皆さんにお話があります。,みなさん に おはなし が あります,皆さん_sentence.mp3,皆さん.mp3,,Tonari no Totoro
皆様,みなさま,皆様、こんにちは。,みなさま こんにちは,皆様_sentence.mp3,皆様.mp3,,
誰か,だれか,誰かに聞いてみてください。,だれか に きいて みて ください,誰か_sentence.mp3,誰か.mp3,,Tonari no Totoro
よろしい,よろしい,レポートはこれでよろしいですか。,れぽーと は これ で よろしい です か,よろしい_sentence.mp3,よろしい.mp3,,
国籍,こくせき,私は日本国籍です。,わたし は にほん こくせき です,国籍_sentence.mp3,国籍.mp3,,
愛,あい,彼女は愛をこめて手紙を書いた。,かのじょ は あい を こめて てがみ を かいた,愛_sentence.mp3,愛.mp3,,
可愛い,かわいい,彼女の赤ちゃんは可愛いです。,かのじょ の あかちゃん は かわいい です,可愛い_sentence.mp3,可愛い.mp3,,Tonari no Totoro
恋人,こいびと,彼は恋人を失った。,かれ は こいびと を うしなった,恋人_sentence.mp3,恋人.mp3,,
ラッシュアワー,らっしゅあわー,私はラッシュアワーの電車が嫌いです。,わたし は らっしゅあわー の でんしゃ が きらい です,ラッシュアワー_sentence.mp3,ラッシュアワー.mp3,,
誕生日,たんじょうび,彼女の誕生日は7月16日です。,かのじょ の たんじょうび は しちがつ じゅうろくにち です,誕生日_sentence.mp3,誕生日.mp3,,
祝日,しゅくじつ,5月3日は祝日だ。,ごがつ みっか は しゅくじつ だ,祝日_sentence.mp3,祝日.mp3,,
お祝い,おいわい,彼の就職のお祝いをしよう。,かれ の しゅうしょく の おいわい を しよう,お祝い_sentence.mp3,お祝い.mp3,,
カップ,かっぷ,水を1カップ入れてください。,みず を いちかっぷ いれて ください,カップ_sentence.mp3,カップ.mp3,,
泣く,なく,妹はすぐに泣く。,いもうと は すぐ に なく,泣く_sentence.mp3,泣く.mp3,,Tonari no Totoro
涙,なみだ,彼女の目から涙がこぼれた。,かのじょ の め から なみだ が こぼれた,涙_sentence.mp3,涙.mp3,,
喜ぶ,よろこぶ,彼女はとても喜びました。,かのじょ は とても よろこびました,喜ぶ_sentence.mp3,喜ぶ.mp3,,Tonari no Totoro
恥ずかしい,はずかしい,とても恥ずかしかった。,とても はずかしかった,恥ずかしい_sentence.mp3,恥ずかしい.mp3,,
スケート,すけーと,湖でスケートをした。,みずうみ で すけーと を した,スケート_sentence.mp3,スケート.mp3,,
弁当,べんとう,今日は弁当を持ってきました。,きょう は べんとう を もって きました,弁当_sentence.mp3,弁当.mp3,,
看護婦,かんごふ,母は看護婦です。,はは は かんごふ です,看護婦_sentence.mp3,看護婦.mp3,,
患者,かんじゃ,患者は眠っています。,かんじゃ は ねむって います,患者_sentence.mp3,患者.mp3,,
述べる,のべる,上司が意見を述べた。,じょうし が いけん を のべた,述べる_sentence.mp3,述べる.mp3,,
たくさん,たくさん,昨日はたくさん泳ぎました。,きのう は たくさん およぎました,たくさん_sentence.mp3,たくさん.mp3,,
訴える,うったえる,彼女は会社を訴えた。,かのじょ は かいしゃ を うったえた,訴える_sentence.mp3,訴える.mp3,,
迷う,まよう,道に迷いました。,みち に まよいました,迷う_sentence.mp3,迷う.mp3,,
迷惑,めいわく,人に迷惑をかけてはいけません。,ひと に めいわく を かけて は いけません,迷惑_sentence.mp3,迷惑.mp3,,
地域,ちいき,この地域は雨が多い。,この ちいき は あめ が おおい,地域_sentence.mp3,地域.mp3,,
ピクニック,ぴくにっく,今日はピクニックに行きましょう。,きょう は ぴくにっく に いきましょう,ピクニック_sentence.mp3,ピクニック.mp3,,
政権,せいけん,政権が交代した。,せいけん が こうたい した,政権_sentence.mp3,政権.mp3,,
贈る,おくる,母に花を贈った。,はは に はな を おくった,贈る_sentence.mp3,贈る.mp3,,Tonari no Totoro
贈り物,おくりもの,すてきな贈り物をどうもありがとう。,すてき な おくりもの を どうも ありがとう,贈り物_sentence.mp3,贈り物.mp3,,
与える,あたえる,そのニュースは彼に大きなショックを与えた。,その にゅーす は かれ に おおき な しょっく を あたえた,与える_sentence.mp3,与える.mp3,,
貯金,ちょきん,貯金は十分にあります。,ちょきん は じゅうぶん に あります,貯金_sentence.mp3,貯金.mp3,,
預ける,あずける,鍵を彼に預けた。,かぎ を かれ に あずけた,預ける_sentence.mp3,預ける.mp3,,
預かる,あずかる,荷物を預かってください。,にもつ を あずかって ください,預かる_sentence.mp3,預かる.mp3,,Tonari no Totoro
