expression,reading,sentence,sentence_kana,sentence_audio,expression_audio,image_uri,tags
元気,げんき,彼女はいつも元気だ,かのじょ は いつも げんき だ,元気_sentence.mp3,元気.mp3,,Tonari no Totoro
勉強,べんきょう,私は日本語を勉強しています。,わたし は にほんご を べんきょう して います,勉強_sentence.mp3,勉強.mp3,,
それ,それ,それはとってもいい話だ。,それ は とっても いい はなし だ,それ_sentence.mp3,それ.mp3,,Tonari no Totoro
恐ろしい,おそろしい,昨夜恐ろしい夢を見た。,ゆうべ おそろしい ゆめ を みた,恐ろしい_sentence.mp3,恐ろしい.mp3,,Tonari no Totoro
一つ,ひとつ,それを一つください。,それ を ひとつ ください,一つ_sentence.mp3,一つ.mp3,,
まあ,まあ,まあこれでいいだろう。,まあこれでいいだろう。,まあ_sentence.mp3,まあ.mp3,,Tonari no Totoro
一,いち,一から始めましょう。,いち から はじめましょう,一_sentence.mp3,一.mp3,,Tonari no Totoro
見える,みえる,ここから富士山がよく見えます。,ここ から ふじさん が よく みえます,見える_sentence.mp3,見える.mp3,,Tonari no Totoro
頃,ころ,子供の頃、よくその公園で遊んだ。,こども の ころ よく その こうえん で あそんだ,頃_sentence.mp3,頃.mp3,,Tonari no Totoro
小さい,ちいさい,小さい花が咲いています。,ちいさい はな が さいて います,小さい_sentence.mp3,小さい.mp3,,
古い,ふるい,私は古い車が好きです。,わたし は ふるい くるま が すき です,古い_sentence.mp3,古い.mp3,,Tonari no Totoro
動く,うごく,動かないで。,うごかない で,動く_sentence.mp3,動く.mp3,,Tonari no Totoro
足,あし,彼は足が長い。,かれ は あし が ながい,足_sentence.mp3,足.mp3,,Tonari no Totoro
逃げる,にげる,鳥が窓から逃げたよ。,とり が まど から にげた よ,逃げる_sentence.mp3,逃げる.mp3,,Tonari no Totoro
どうして,どうして,どうして泣いているの。,どうして ないて いる の,どうして_sentence.mp3,どうして.mp3,,
時々,ときどき,彼は時々遅刻します。,かれ は ときどき ちこく します,時々_sentence.mp3,時々.mp3,,Tonari no Totoro
忙しい,いそがしい,忙しいので手伝ってください。,いそがしい の で てつだって ください,忙しい_sentence.mp3,忙しい.mp3,,Tonari no Totoro
田,た,今は田に水を入れる季節です。,いま は た に みず を いれる きせつ です,田_sentence.mp3,田.mp3,,
今,いま,彼は今、勉強しています。,かれ は いま べんきょう して います,今_sentence.mp3,今.mp3,,Tonari no Totoro
十分,じゅうぶん,お金はまだ十分あります。,おかね は まだ じゅうぶん あります,十分_sentence.mp3,十分.mp3,,Tonari no Totoro
急ぐ,いそぐ,私たちは駅へ急ぎました。,わたしたち は えき へ いそぎました,急ぐ_sentence.mp3,急ぐ.mp3,,Tonari no Totoro
手入れ,ていれ,母は庭の手入れをしています。,はは は にわ の ていれ を して います,手入れ_sentence.mp3,手入れ.mp3,,Tonari no Totoro
賢い,かしこい,彼は冷静で賢い男だね。,かれ は れいせい で かしこい おとこ だ ね,賢い_sentence.mp3,賢い.mp3,,Tonari no Totoro
来る,くる,彼は昼過ぎに来ます。,かれ は ひるすぎ に きます,来る_sentence.mp3,来る.mp3,,Tonari no Totoro
応援,おうえん,大勢が応援に駆けつけてくれたよ。,おおぜい が おうえん に かけつけて くれた よ,応援_sentence.mp3,応援.mp3,,Tonari no Totoro
お祖母さん,おばあさん,彼女はお祖母さんと住んでいる。,かのじょ は おばあさん と すん でいる 。,お祖母さん_sentence.mp3,お祖母さん.mp3,,
隣,となり,隣の家には犬がいます。,となり の いえ に は いぬ が います,隣_sentence.mp3,隣.mp3,,Tonari no Totoro
センター,センター,このセンターで工場全体を管理しています。,この せんたー で こうじょう ぜんたい を かんり して います,センター_sentence.mp3,センター.mp3,,
管理,かんり,彼女が私のスケジュールを管理している。,かのじょ が わたし の すけじゅーる を かんり して いる,管理_sentence.mp3,管理.mp3,,Tonari no Totoro
お姉さん,おねえさん,昨日、あなたのお姉さんに会ったよ。,きのう あなた の おねえさん に あった よ,お姉さん_sentence.mp3,お姉さん.mp3,,Tonari no Totoro
大変,たいへん,大変なことが起こりました。,たいへん な こと が おこりました,大変_sentence.mp3,大変.mp3,,Tonari no Totoro
夢,ゆめ,昨夜恐ろしい夢を見た。,ゆうべ おそろしい ゆめ を みた,夢_sentence.mp3,夢.mp3,,Tonari no Totoro
時,とき,時の経つのは早い。,とき の たつ の は はやい,時_sentence.mp3,時.mp3,,Tonari no Totoro
やっぱり,やっぱり,やっぱり旅が大好きだ。,やっぱり たび が だいすき だ,やっぱり_sentence.mp3,やっぱり.mp3,,Tonari no Totoro
便所,べんじょ,便所はそこです。,べんじょ は そこ です,便所_sentence.mp3,便所.mp3,,Tonari no Totoro
階段,かいだん,私たちは駅の階段をかけ上がった。,わたしたち は えき の かいだん を かけあがった,階段_sentence.mp3,階段.mp3,,Tonari no Totoro
仕事,しごと,3月は仕事が忙しい。,さんがつ は しごと が いそがしい,仕事_sentence.mp3,仕事.mp3,,Tonari no Totoro
上,うえ,お上は何を考えてるんだろうね。,おかみ は なに を かんがえて る ん だろう ね,上_sentence.mp3,上.mp3,,Tonari no Totoro
入る,はいる,寒いので中に入ってください。,さむい の で なか に はいって ください,入る_sentence.mp3,入る.mp3,,Tonari no Totoro
出る,でる,今朝は早く家を出ました。,けさ は はやく いえ を でました,出る_sentence.mp3,出る.mp3,,Tonari no Totoro
目,め,彼女は青い目をしています。,かのじょ は あおい め を して います,目_sentence.mp3,目.mp3,,Tonari no Totoro
どこ,どこ,あの本をどこに置きましたか。,あの ほん を どこ に おきました か,どこ_sentence.mp3,どこ.mp3,,Tonari no Totoro
好き,すき,私はワインが好きです。,わたし は わいん が すき です,好き_sentence.mp3,好き.mp3,,Tonari no Totoro
気,き,彼は意外に気が小さい。,かれ は いがい に き が ちいさい,気_sentence.mp3,気.mp3,,Tonari no Totoro
天気,てんき,今日はいい天気ですね。,きょう は いい てんき です ね,天気_sentence.mp3,天気.mp3,,
開ける,あける,男の子がドアを開ける,おとこのこ が ドア を あける,開ける_sentence.mp3,開ける.mp3,,Tonari no Totoro
見せる,みせる,その写真を見せてください。,その しゃしん を みせて ください,見せる_sentence.mp3,見せる.mp3,,Tonari no Totoro
ここ,ここ,ここに本があります。,ここ に ほん が あります,ここ_sentence.mp3,ここ.mp3,,Tonari no Totoro
部屋,へや,私の部屋は2階にあります。,わたし の へや は にかい に あります,部屋_sentence.mp3,部屋.mp3,,Tonari no Totoro
早い,はやい,まだ学校へ行くには早い時間です。,まだ がっこう へ いく に は はやい じかん です,早い_sentence.mp3,早い.mp3,,Tonari no Totoro
お願い,おねがい,お願いがあります。,おねがい が あります,お願い_sentence.mp3,お願い.mp3,,Tonari no Totoro
落ちる,おちる,猿も木から落ちる。,さる も き から おちる,落ちる_sentence.mp3,落ちる.mp3,,Tonari no Totoro
木,き,台風で木が倒れた。,たいふう で き が たおれた,木_sentence.mp3,木.mp3,,Tonari no Totoro
何か,なにか,どうしましたか？―目の中に何かが入りました。,どうしましたか？―め の なか に なにか が はいりました。,何か_sentence.mp3,何か.mp3,,Tonari no Totoro
中,なか,今は真夜中だ。,いま は まよなか だ,中_sentence.mp3,中.mp3,,Tonari no Totoro
雨,あめ,雨が降っています。,あめ が ふって います,雨_sentence.mp3,雨.mp3,,Tonari no Totoro
明るい,あかるい,彼女は明るい性格です。,かのじょ は あかるい せいかく です,明るい_sentence.mp3,明るい.mp3,,Tonari no Totoro
暗い,くらい,東の空が暗いです。,ひがし の そら が くらい です,暗い_sentence.mp3,暗い.mp3,,Tonari no Totoro
黒い,くろい,彼女は黒いドレスを着ています。,かのじょ は くろい どれす を きて います,黒い_sentence.mp3,黒い.mp3,,Tonari no Totoro
魚,さかな,肉と魚とどちらが好きですか。,にく と さかな と どちら が すき です か,魚_sentence.mp3,魚.mp3,,Tonari no Totoro
急に,きゅうに,急に用事を思い出した。,きゅうに ようじ を おもいだした,急に_sentence.mp3,急に.mp3,,
運ぶ,はこぶ,いすを二階に運んでください。,いす を にかい に はこんで ください,運ぶ_sentence.mp3,運ぶ.mp3,,Tonari no Totoro
早く,はやく,なるべく早く来て下さい。,なるべく はやく きて ください,早く_sentence.mp3,早く.mp3,,
橋,はし,あの橋は日本で一番長い。,あの はし は にほん で いちばん ながい,橋_sentence.mp3,橋.mp3,,Tonari no Totoro
裏,うら,会社の裏に公園があります。,かいしゃ の うら に こうえん が あります,裏_sentence.mp3,裏.mp3,,Tonari no Totoro
草,くさ,庭に草が生えている。,にわ に くさ が はえて いる,草_sentence.mp3,草.mp3,,
壁,かべ,壁に絵が掛かっている。,かべ に え が かかって いる,壁_sentence.mp3,壁.mp3,,
湯,ゆ,お風呂のお湯が一杯です。,おふろ の おゆ が いっぱい です,湯_sentence.mp3,湯.mp3,,
戸,と,部屋の戸が開いています。,へや の と が あいて います,戸_sentence.mp3,戸.mp3,,Tonari no Totoro
こんなに,こんなに,こんなに面白い本は初めて読んだ。,こんなに おもしろい ほん は はじめて よんだ,こんなに_sentence.mp3,こんなに.mp3,,Tonari no Totoro
お巡りさん,おまわりさん,あのお巡りさんに道を聞きましょう。,あの おまわりさん に みち を ききましょう,お巡りさん_sentence.mp3,お巡りさん.mp3,,Tonari no Totoro
腐る,くさる,リンゴが腐っている。,りんご が くさって いる,腐る_sentence.mp3,腐る.mp3,,Tonari no Totoro
絵本,えほん,その子は絵本が大好きです。,その こ は えほん が だいすき です,絵本_sentence.mp3,絵本.mp3,,Tonari no Totoro
いらっしゃる,いらっしゃる,お客様がいらっしゃいました。,おきゃくさま が いらっしゃいました,いらっしゃる_sentence.mp3,いらっしゃる.mp3,,Tonari no Totoro
きらりと,きらりと,ダイヤモンドがきらりと光った。,だいやもんど が きらりと ひかった,きらりと_sentence.mp3,きらりと.mp3,,
光,ひかり,一筋の光が窓から差し込んだの。,ひとすじ の ひかり が まど から さしこんだ の,光_sentence.mp3,光.mp3,,
玉,たま,彼の顔に玉のような汗が流れていたの。,かれ の かお に たま の よう な あせ が ながれて いた の,玉_sentence.mp3,玉.mp3,,
気に入る,きにいる,新しい靴がとても気に入りました。,あたらしい くつ が とても きにいりました,気に入る_sentence.mp3,気に入る.mp3,,Tonari no Totoro
光る,ひかる,波がきらきら光っていました。,なみ が きらきら ひかって いました,光る_sentence.mp3,光る.mp3,,Tonari no Totoro
引っ越し,ひっこし,去年、引っ越ししました。,きょねん ひっこし しました,引っ越し_sentence.mp3,引っ越し.mp3,,Tonari no Totoro
引っ越す,ひっこす,来月、大阪に引っ越します。,らいげつ おおさか に ひっこします,引っ越す_sentence.mp3,引っ越す.mp3,,Tonari no Totoro
お父さん,おとうさん,お父さんは会社員です。,おとうさん は かいしゃいん です,お父さん_sentence.mp3,お父さん.mp3,,Tonari no Totoro
郊外,こうがい,私は郊外に家を買いました。,わたし は こうがい に いえ を かいました,郊外_sentence.mp3,郊外.mp3,,
移る,うつる,彼女は新しい会社に移った。,かのじょ は あたらしい かいしゃ に うつった,移る_sentence.mp3,移る.mp3,,
隠れる,かくれる,太陽が雲に隠れた。,たいよう が くも に かくれた,隠れる_sentence.mp3,隠れる.mp3,,Tonari no Totoro
ああ,ああ,ああうるさい人は苦手です。,ああ うるさい ひと は にがて です,ああ_sentence.mp3,ああ.mp3,,Tonari no Totoro
あいづち,あいづち,彼の話に私はあいづちを打ったの。,かれ の はなし に わたし は あいづち を うった の,あいづち_sentence.mp3,あいづち.mp3,,
あいにく,あいにく,途中であいにく雨が降り出したの。,とちゅう で あいにく あめ が ふりだした の,あいにく_sentence.mp3,あいにく.mp3,,
あえて,あえて,彼はあえて危険を冒したの。,かれ は あえて きけん を おかした,あえて_sentence.mp3,あえて.mp3,,
あきれる,あきれる,彼の頑固さにはあきれました。,かれ の がんこさ に は あきれました,あきれる_sentence.mp3,あきれる.mp3,,
あくび,あくび,父があくびをした。,ちち が あくび を した,あくび_sentence.mp3,あくび.mp3,,
あぐら,あぐら,彼はあぐらをかいてしゃべっていますね。,かれ は あぐら を かいて しゃべって います ね,あぐら_sentence.mp3,あぐら.mp3,,
あげる,あげる,この本、あなたにあげます。,この ほん あなた に あげます,あげる_sentence.mp3,あげる.mp3,,Tonari no Totoro
あそこ,あそこ,あそこにバス停があります。,あそこ に ばすてい が あります,あそこ_sentence.mp3,あそこ.mp3,,
あだな,あだな,彼のあだなは「りき」です。,かれ の あだな は 「 りき 」 です 。,あだな_sentence.mp3,あだな.mp3,,
あちこち,あちこち,私たちは朝からあちこち散歩しました。,わたしたち は あさ から あちこち さんぽ しました,あちこち_sentence.mp3,あちこち.mp3,,
あちら,あちら,あちらに行ってみよう。,あちら に いって みよう,あちら_sentence.mp3,あちら.mp3,,
あちらこちら,あちらこちら,あちらこちらで紅葉がきれいですね。,あちらこちら で こうよう が きれい です ね,あちらこちら_sentence.mp3,あちらこちら.mp3,,
あっさり,あっさり,そうあっさり言わないで。,そう あっさり いわない で,あっさり_sentence.mp3,あっさり.mp3,,
あっち,あっち,郵便局はあっちです。,ゆうびんきょく は あっち です,あっち_sentence.mp3,あっち.mp3,,
あなた,あなた,この本、あなたにあげます。,この ほん あなた に あげます,あなた_sentence.mp3,あなた.mp3,,Tonari no Totoro
あふれる,あふれる,バスタブからお湯があふれました。,ばすたぶ から おゆ が あふれました,あふれる_sentence.mp3,あふれる.mp3,,
あまり,あまり,このビールはあまり美味しくありません。,この びーる は あまり おいしく ありません,あまり_sentence.mp3,あまり.mp3,,
あらかじめ,あらかじめ,あらかじめ必要な物を書き出して下さい。,あらかじめ ひつよう な もの を かきだして ください,あらかじめ_sentence.mp3,あらかじめ.mp3,,
あり,あり,ありの群れが砂糖にたかっている。,あり の むれ が さとう に たかっている 。,あり_sentence.mp3,あり.mp3,,
あれ,あれ,あれは何ですか。,あれ は なん です か,あれ_sentence.mp3,あれ.mp3,,Tonari no Totoro
あれこれ,あれこれ,服を買うのにあれこれ迷いました。,ふく を かう の に あれこれ まよいました,あれこれ_sentence.mp3,あれこれ.mp3,,
あんなに,あんなに,あんなにいい人はいません。,あんなに いい ひと は いません,あんなに_sentence.mp3,あんなに.mp3,,
あんまり,あんまり,これはあんまり好きじゃないな。,これ は あんまり すき じゃ ない な,あんまり_sentence.mp3,あんまり.mp3,,
いい加減,いいかげん,いい加減なことを言ってはいけません。,いいかげん な こと を いって は いけません,いい加減_sentence.mp3,いい加減.mp3,,
いか,いか,私はイカの刺し身が大好きです。,わたし は いか の さしみ が だいすき です,いか_sentence.mp3,,,
いかが,いかが,お加減はいかがですか。,おかげん は いかが です か,いかが_sentence.mp3,いかが.mp3,,
いかに,いかに,彼に会えば、彼がいかに良い人か分かります。,かれ に あえば かれ が いかに いい ひと か わかります,いかに_sentence.mp3,いかに.mp3,,
いかにも,いかにも,彼はいかにもスポーツマンらしいですね。,かれ は いかにも すぽーつまん らしい です ね,いかにも_sentence.mp3,いかにも.mp3,,
いきなり,いきなり,後ろからいきなり肩をたたかれた。,うしろ から いきなり かた を たたかれた,いきなり_sentence.mp3,いきなり.mp3,,
いけない,いけない,勉強を怠けてはいけないよ。,べんきょう を なまけて は いけない よ,いけない_sentence.mp3,いけない.mp3,,
いずれ,いずれ,いずれまたお会いしましょう。,いずれ また おあい しましょう,いずれ_sentence.mp3,いずれ.mp3,,
岸,きし,船がやっと岸に着いたよ。,ふね が やっと きし に ついた よ,岸_sentence.mp3,岸.mp3,,
いたずら,いたずら,その子はいたずらが大好きだ。,その こ は いたずら が だいすき だ,いたずら_sentence.mp3,いたずら.mp3,,
いちいち,いちいち,彼はいちいち私に指図する。,かれ は いちいち わたし に さしず する,いちいち_sentence.mp3,いちいち.mp3,,
いつ,いつ,彼女はいつ来ますか。,かのじょ は いつ きます か,いつ_sentence.mp3,いつ.mp3,,Tonari no Totoro
いつか,いつか,僕はいつかアフリカに行きたい。,ぼく は いつか あふりか に いきたい,いつか_sentence.mp3,いつか.mp3,,
いつごろ,いつごろ,いつごろ夏休みを取りますか。,いつごろ なつやすみ を とります か,いつごろ_sentence.mp3,いつごろ.mp3,,
いつでも,いつでも,いつでもうちに来てください。,いつでも うち に きて ください,いつでも_sentence.mp3,いつでも.mp3,,
いつのまに,いつのまに,彼はいつのまにいなくなったの。,かれ は いつのまに いなく なった の,いつのまに_sentence.mp3,いつのまに.mp3,,
いつのまにか,いつのまにか,いつのまにか夜が明けていたね。,いつのまにか よ が あけて いた ね,いつのまにか_sentence.mp3,いつのまにか.mp3,,
いつまでも,いつまでも,いつまでもあなたを忘れません。,いつまでも あなた を わすれません,いつまでも_sentence.mp3,いつまでも.mp3,,
いつも,いつも,彼女はいつも元気だ。,かのじょ は いつも げんき だ,いつも_sentence.mp3,いつも.mp3,,Tonari no Totoro
いとこ,いとこ,従兄弟と私は同じ年です。,いとこ と わたし は おなじ とし です,いとこ_sentence.mp3,いとこ.mp3,,
いびき,いびき,父のいびきは大きいんだ。,ちち の いびき は おおきい ん だ,いびき_sentence.mp3,いびき.mp3,,
いやいや,いやいや,その子はいやいや学校へ行ったの。,その こ は いやいや がっこう へ いった の,いやいや_sentence.mp3,いやいや.mp3,,
いやらしい,いやらしい,彼はいやらしい男ね。,かれ は いやらしい おとこ ね,いやらしい_sentence.mp3,いやらしい.mp3,,
いよいよ,いよいよ,明日はいよいよ出発の日です。,あした は いよいよ しゅっぱつ の ひ です,いよいよ_sentence.mp3,いよいよ.mp3,,Tonari no Totoro
いらいら,いらいら,彼女は朝からいらいらしている。,かのじょ は あさ から いらいら して いる,いらいら_sentence.mp3,いらいら.mp3,,
うがい,うがい,冬はまめにうがいをします。,ふゆ は まめ に うがい を します,うがい_sentence.mp3,うがい.mp3,,
うきうき,うきうき,もうすぐ夏休みなのでうきうきしています。,もうすぐ なつやすみ な の で うきうき して います,うきうき_sentence.mp3,うきうき.mp3,,
うちわ,うちわ,父はうちわで扇いでいるの。,ちち は うちわ で あおいで いる の,うちわ_sentence.mp3,うちわ.mp3,,
うっかり,うっかり,大事なメールをうっかり消してしまった。,だいじ な めーる を うっかり けして しまった,うっかり_sentence.mp3,うっかり.mp3,,
うつむく,うつむく,彼はうつむいて何かを考えているね。,かれ は うつむいて なにか を かんがえて いる ね,うつむく_sentence.mp3,うつむく.mp3,,
うどん,うどん,私はお昼にうどんを食べました。,わたし は おひる に うどん を たべました,うどん_sentence.mp3,うどん.mp3,,
うなずく,うなずく,彼女はうなずいて同意を示したの。,かのじょ は うなずいて どうい を しめした の,うなずく_sentence.mp3,うなずく.mp3,,
うまい,うまい,うまい寿司屋を見つけたよ。,うまい すしや を みつけた よ,うまい_sentence.mp3,うまい.mp3,,
うるさい,うるさい,あまりうるさく言わないで下さい。,あまり うるさく いわない で ください,うるさい_sentence.mp3,うるさい.mp3,,
うろうろ,うろうろ,その男はロビーをしばらくうろうろしていたよ。,その おとこ は ろびー を しばらく うろうろ して いた よ,うろうろ_sentence.mp3,うろうろ.mp3,,
えび,えび,私はえびの天ぷらが好きです,わたし は えび の てんぷら が すき です,えび_sentence.mp3,えび.mp3,,
おいしい,おいしい,このケーキはおいしいね。,この けーき は おいしい ね,おいしい_sentence.mp3,おいしい.mp3,,Tonari no Totoro
おかしい,おかしい,彼の話はおかしかった。,かれ の はなし は おかしかった,おかしい_sentence.mp3,おかしい.mp3,,Tonari no Totoro
おかず,おかず,晩ご飯のおかずは何?,ばんごはん の おかず は なに,おかず_sentence.mp3,おかず.mp3,,
おごる,おごる,彼に食事をおごってもらった。,かれ に しょくじ を おごって もらった,おごる_sentence.mp3,おごる.mp3,,
おしゃべり,おしゃべり,彼女たちはおしゃべりに夢中です。,かのじょたち は おしゃべり に むちゅう です,おしゃべり_sentence.mp3,おしゃべり.mp3,,
おしゃれ,おしゃれ,あの子はおしゃれだね。,あの こ は おしゃれ だ ね,おしゃれ_sentence.mp3,おしゃれ.mp3,,
おじ,おじ,おじは銀行に勤めています。,おじ は ぎんこう に つとめて います,おじ_sentence.mp3,おじ.mp3,,
おじさん,おじさん,昨日おじさんに会いました。,きのう おじさん に あいました,おじさん_sentence.mp3,おじさん.mp3,,Tonari no Totoro
おだてる,おだてる,彼は人をおだてるのが上手です。,かれ は ひと を おだてる の が じょうず です,おだてる_sentence.mp3,おだてる.mp3,,
おっしゃる,おっしゃる,あなたのおっしゃる通りです。,あなた の おっしゃる とおり です,おっしゃる_sentence.mp3,おっしゃる.mp3,,
おなか,おなか,おなかが空きました。,おなか が すきました,おなか_sentence.mp3,おなか.mp3,,
おにぎり,おにぎり,昼食におにぎりを食べました。,ちゅうしょく に おにぎり を たべました,おにぎり_sentence.mp3,おにぎり.mp3,,
おば,おば,おばは大阪に住んでいます。,おば は おおさか に すんで います,おば_sentence.mp3,おば.mp3,,
おばさん,おばさん,おばさん、こんにちは。,おばさん、こんにちは。,おばさん_sentence.mp3,おばさん.mp3,,
おまけ,おまけ,八百屋さんでたくさんおまけしてもらったよ。,やおや さん で たくさん おまけ して もらった よ,おまけ_sentence.mp3,おまけ.mp3,,
おもちゃ,おもちゃ,赤ちゃんが自動車のおもちゃで遊んでいる。,あかちゃん が じどうしゃ の おもちゃ で あそんで いる,おもちゃ_sentence.mp3,おもちゃ.mp3,,
おやつ,おやつ,今日のおやつはプリンだった。,きょう の おやつ は ぷりん だった,おやつ_sentence.mp3,おやつ.mp3,,
およそ,およそ,家から駅までおよそ1キロあります。,いえ から えき まで およそ いちきろ あります,およそ_sentence.mp3,およそ.mp3,,
