expression,reading,sentence,sentence_kana,sentence_audio,expression_audio,image_uri
初期,しょき,病気の初期症状が現れました。,びょうき の しょき しょうじょう が あらわれました,,,, 
学期,がっき,新しい学期が始まりました。,あたらしい がっき が はじまりました,,,, 
後期,こうき,大学の後期の授業が始まりました。,だいがく の こうき の じゅぎょう が はじまりました,,,, 
前期,ぜんき,前期の成績が発表されました。,ぜんき の せいせき が はっぴょう されました,,,, 
きつい,きつい,この靴は少しきついです。,この くつ は すこし きつい です,,,, 
期日,きじつ,期日までに書類を提出してください。,きじつ まで に しょるい を ていしゅつ して ください,,,, 
新学期,しんがっき,新学期がもうすぐ始まります。,しんがっき が もうすぐ はじまります,,,, 
限り,かぎり,このサービスは期間限定です。,この サービス は きかん げんてい です,,,, 
制限,せいげん,速度制限を守って運転してください。,そくど せいげん を まもって うんてん してください,,,, 
限界,げんかい,彼は自分の限界を乗り越えました。,かれ は じぶん の げんかい を のりこえました,,,, 
期限,きげん,申請書の期限が迫っています。,しんせいしょ の きげん が せまっています,,,, 
限度,げんど,このカードには利用限度があります。,この カード に は りよう げんど が あります,,,, 
大急ぎ,おおいそぎ,大急ぎで準備をしました。,おおいそぎ で じゅんび を しました,,,, 
コーナー,コーナー,その本は雑誌コーナーにあります。,その ほん は ざっし コーナー に あります,,,, 
急用,きゅうよう,急用ができたので帰ります。,きゅうよう が できた ので かえります,,,, 
一切,いっさい,その件について一切知らない。,その けん に ついて いっさい しらない,,,, 
区切る,くぎる,文章を適切に区切ってください。,ぶんしょう を てきせつ に くぎって ください,,,, 
思い切って,おもいきって,思い切って転職することにしました。,おもいきって てんしょく する こと に しました,,,, 
品切れ,しなぎれ,この商品は品切れ中です。,この しょうひん は しなぎれ ちゅう です,,,, 
思い切り,おもいきり,思い切り遊んでください。,おもいきり あそんで ください,,,, 
切れ,きれ,このナイフはよく切れます。,この ナイフ は よく きれます,,,, 
ぎりぎり,ぎりぎり,ぎりぎりで電車に間に合いました。,ぎりぎり で でんしゃ に まにあいました,,,, 
券,けん,映画の券を買いました。,えいが の けん を かいました,,,, 
回数券,かいすうけん,回数券を使えばお得です。,かいすうけん を つかえば おとく です,,,, 
世代,せだい,その歌は若い世代に人気があります。,その うた は わかい せだい に にんき が あります,,,, 
代わり,かわり,彼の代わりに出席しました。,かれ の かわり に しゅっせき しました,,,, 
近代,きんだい,近代建築の美しさに感動しました。,きんだい けんちく の うつくしさ に かんどう しました,,,, 
古代,こだい,古代文明について勉強しました。,こだい ぶんめい について べんきょう しました,,,, 
代わる代わる,かわるがわる,彼らは代わる代わる意見を述べました。,かれら は かわるがわる いけん を のべました,,,, 
ウサギ,ウサギ,森でウサギを見かけました。,もり で ウサギ を みかけました,,,, 
指す,さす,時計の針は12時を指しています。,とけい の はり は 12じ を さして います,,,, 
小指,こゆび,彼は小指を怪我しました。,かれ は こゆび を けがしました,,,,
安定,あんてい,彼の仕事は収入が安定しています。,かれ の しごと は しゅうにゅう が あんてい して います,,,, 
規定,きてい,規定に従って手続きを進めてください。,きてい に したがって てつづき を すすめて ください,,,, 
定める,さだめる,新しいルールを定めました。,あたらしい ルール を さだめました,,,, 
指定,してい,この座席は指定席です。,この ざせき は していせき です,,,, 
悪化,あっか,彼の病状が悪化しました。,かれ の びょうじょう が あっか しました,,,, 
化学,かがく,彼は大学で化学を専攻しています。,かれ は だいがく で かがく を せんこう して います,,,, 
グラウンド,グラウンド,子供たちはグラウンドで遊んでいます。,こどもたち は グラウンド で あそんで います,,,, 
消化,しょうか,食べ物をよく噛むと消化が良くなります。,たべもの を よく かむ と しょうか が よく なります,,,, 
更に,さらに,彼は更に努力を重ねています。,かれ は さらに どりょく を かさねて います,,,, 
今更,いまさら,今更言っても遅いです。,いまさら いって も おそい です,,,, 
急増,きゅうぞう,オンラインショッピングが急増しています。,オンライン ショッピング が きゅうぞう して います,,,, 
減少,げんしょう,観光客の数が減少しています。,かんこうきゃく の かず が げんしょう して います,,,, 
乗車券,じょうしゃけん,駅で乗車券を購入しました。,えき で じょうしゃけん を こうにゅう しました,,,, 
乗車,じょうしゃ,次のバス停で乗車してください。,つぎ の バスてい で じょうしゃ してください,,,, 
さっぱり,さっぱり,シャワーを浴びた後はさっぱりします。,シャワー を あびた あと は さっぱり します,,,, 
乗客,じょうきゃく,この列車には多くの乗客が乗っています。,この れっしゃ に は おおく の じょうきゃく が のっています,,,, 
雨降り,あめふり,今日は雨降りなので傘を持って行きます。,きょう は あめふり なので かさ を もって いきます,,,, 
税金,ぜいきん,税金を納めるのは国民の義務です。,ぜいきん を おさめる の は こくみん の ぎむ です,,,, 
税,ぜい,消費税が増税されました。,しょうひぜい が ぞうぜい されました,,,, 
私立,しりつ,彼は私立の高校に通っています。,かれ は しりつ の こうこう に かよって います,,,, 
市立,しりつ,市立図書館で本を借りました。,しりつ としょかん で ほん を かりました,,,, 
県立,けんりつ,この県立高校はとても有名です。,この けんりつ こうこう は とても ゆうめい です,,,, 
シャッター,シャッター,シャッターを閉めてください。,シャッター を しめて ください,,,, 
国立,こくりつ,彼は国立大学で学んでいます。,かれ は こくりつ だいがく で まなんで います,,,, 
座席,ざせき,座席を予約しました。,ざせき を よやく しました,,,, 
客席,きゃくせき,客席からステージがよく見えます。,きゃくせき から ステージ が よく みえます,,,, 
欠点,けってん,彼の欠点は忘れっぽいところです。,かれ の けってん は わすれっぽい ところ です,,,, 
欠ける,かける,その皿は少し欠けています。,その さら は すこし かけています,,,, 
欠く,かく,彼は礼儀を欠いています。,かれ は れいぎ を かいて います,,,, 
次回,じかい,次回の会議は来週です。,じかい の かいぎ は らいしゅう です,,,, 
運用,うんよう,新しいシステムが運用されています。,あたらしい システム が うんよう されて います,,,, 
スピーカー,スピーカー,会場のスピーカーの音がとてもクリアです。,かいじょう の スピーカー の おと が とても クリア です,,,, 
運営,うんえい,イベントの運営を担当しています。,イベント の うんえい を たんとう して います,,,, 
運賃,うんちん,運賃は前払いです。,うんちん は まえばらい です,,,, 
運,うん,運が良ければ成功します。,うん が よければ せいこう します,,,, 
運送,うんそう,この会社は国際運送を行っています。,この かいしゃ は こくさい うんそう を おこなっています,,,, 
回転,かいてん,この車輪は滑らかに回転します。,この しゃりん は なめらか に かいてん します,,,, 
転がる,ころがる,ボールが坂道を転がっています。,ボール が さかみち を ころがっています,,,, 
転がす,ころがす,彼はボールを転がして遊んでいます。,かれ は ボール を ころがして あそんで います,,,, 
セールスマン,セールスマン,彼は優秀なセールスマンです。,かれ は ゆうしゅう な セールスマン です,,,, 
移転,いてん,会社が新しいビルに移転しました。,かいしゃ が あたらしい ビル に いてん しました,,,, 
移動,いどう,会議室から移動しましょう。,かいぎしつ から いどう しましょう,,,, 
行動,こうどう,彼の行動は尊敬に値します。,かれ の こうどう は そんけい に あたい します,,,, 
運動会,うんどうかい,学校で運動会が開かれます。,がっこう で うんどうかい が ひらかれます,,,, 
運動場,うんどうじょう,運動場でスポーツを楽しみました。,うんどうじょう で スポーツ を たのしみました,,,, 
高速,こうそく,この電車は高速で走ります。,この でんしゃ は こうそく で はしります,,,, 
おしゃべり,おしゃべり,友達と楽しくおしゃべりしました。,ともだち と たのしく おしゃべり しました,,,, 
急速,きゅうそく,技術が急速に進化しています。,ぎじゅつ が きゅうそく に しんか して います,,,, 
高速道路,こうそくどうろ,高速道路で渋滞に遭いました。,こうそくどうろ で じゅうたい に あいました,,,, 
早速,さっそく,早速その件について調査します。,さっそく その けん について ちょうさ します,,,, 
時速,じそく,この車は時速100キロで走ります。,この くるま は じそく 100キロ で はしります,,,, 
全速力,ぜんそくりょく,彼は全速力でゴールを目指しました。,かれ は ぜんそくりょく で ゴール を めざしました,,,, 
遅れ,おくれ,列車が10分遅れています。,れっしゃ が 10ぷん おくれています,,,, 
遅らす,おくらす,彼は会議を30分遅らせました。,かれ は かいぎ を 30ぷん おくらせました,,,, 
カラオケ,カラオケ,友達とカラオケに行きました。,ともだち と カラオケ に いきました,,,, 
終える,おえる,宿題を終えてから遊びに行きました。,しゅくだい を おえて から あそび に いきました,,,, 
最終,さいしゅう,最終電車に間に合いました。,さいしゅう でんしゃ に まにあいました,,,, 
終点,しゅうてん,このバスは次の駅が終点です。,この バス は つぎ の えき が しゅうてん です,,,, 
始終,しじゅう,彼は始終笑顔でした。,かれ は しじゅう えがお でした,,,, 
終電,しゅうでん,終電を逃さないように急ぎましょう。,しゅうでん を のがさない よう に いそぎましょう,,,, 
現地,げんち,現地での調査が必要です。,げんち で の ちょうさ が ひつよう です,,,, 
現代,げんだい,この小説は現代社会を描いています。,この しょうせつ は げんだい しゃかい を えがいて います,,,, 
現金,げんきん,支払いは現金でお願いします。,しはらい は げんきん で おねがいします,,,, 
こっそり,こっそり,彼はこっそり部屋を抜け出しました。,かれ は こっそり へや を ぬけだしました,,,, 
現れる,あらわれる,虹が空に現れました。,にじ が そら に あらわれました,,,, 
現場,げんば,警察は現場で調査を行っています。,けいさつ は げんば で ちょうさ を おこなっています,,,, 
現住所,げんじゅうしょ,現住所をこちらに記入してください。,げんじゅうしょ を こちら に きにゅう してください,,,, 
現す,あらわす,彼女は笑顔で感謝の気持ちを現しました。,かのじょ は えがお で かんしゃ の きもち を あらわしました,,,, 
現れ,あらわれ,この結果は努力の現れです。,この けっか は どりょく の あらわれ です,,,, 
在学,ざいがく,彼は大学に在学しています。,かれ は だいがく に ざいがく して います,,,,
現実,げんじつ,現実を受け入れるのは時に難しいです。,げんじつ を うけいれる の は とき に むずかしい です,,,, 
ジョギング,ジョギング,毎朝ジョギングをしています。,まいあさ ジョギング を して います,,,, 
実は,じつは,実は彼女に会うのは初めてです。,じつは かのじょ に あう の は はじめて です,,,, 
実用,じつよう,このツールは実用性が高いです。,この ツール は じつようせい が たかい です,,,, 
実力,じつりょく,彼は実力でその地位を得ました。,かれ は じつりょく で その ちい を えました,,,, 
実習,じっしゅう,大学では実習の授業があります。,だいがく で は じっしゅう の じゅぎょう が あります,,,, 
実物,じつぶつ,実物を見て買うことにしました。,じつぶつ を みて かう こと に しました,,,, 
実に,じつに,彼のパフォーマンスは実に素晴らしいです。,かれ の パフォーマンス は じつに すばらしい です,,,, 
過ごす,すごす,週末を友達と過ごしました。,しゅうまつ を ともだち と すごしました,,,, 
経過,けいか,時間の経過とともに痛みが和らぎます。,じかん の けいか と ともに いたみ が やわらぎます,,,, 
過ち,あやまち,過ちは誰にでもあります。,あやまち は だれ に でも あります,,,, 
去る,さる,彼は昨日町を去りました。,かれ は きのう まち を さりました,,,, 
活発,かっぱつ,彼女はとても活発な性格です。,かのじょ は とても かっぱつ な せいかく です,,,, 
始発,しはつ,始発電車に乗って出かけました。,しはつ でんしゃ に のって でかけました,,,, 
表す,あらわす,感謝の気持ちを手紙で表しました。,かんしゃ の きもち を てがみ で あらわしました,,,, 
言い表わす,いいあらわす,彼の感情を言い表わすのは難しいです。,かれ の かんじょう を いいあらわす の は むずかしい です,,,, 
雑音,ざつおん,雑音が多くて話が聞こえません。,ざつおん が おおくて はなし が きこえません,,,, 
足音,あしおと,誰かの足音が聞こえます。,だれか の あしおと が きこえます,,,, 
音読み,おんよみ,漢字の音読みを覚えるのは難しいです。,かんじ の おんよみ を おぼえる の は むずかしい です,,,, 
五十音,ごじゅうおん,日本語の五十音を覚えましょう。,にほんご の ごじゅうおん を おぼえましょう,,,, 
気楽,きらく,気楽な気持ちで会話を楽しみましょう。,きらく な きもち で かいわ を たのしみましょう,,,, 
行楽,こうらく,秋は行楽に最適な季節です。,あき は こうらく に さいてき な きせつ です,,,, 
薬指,くすりゆび,彼は薬指に指輪をはめています。,かれ は くすりゆび に ゆびわ を はめています,,,, 
サークル,サークル,彼は大学のテニスサークルに所属しています。,かれ は だいがく の テニス サークル に しょぞく して います,,,, 
食欲,しょくよく,運動した後は食欲が増します。,うんどう した あと は しょくよく が ます します,,,, 
映る,うつる,テレビの画面に映っています。,テレビ の がめん に うつっています,,,, 
映す,うつす,彼女の笑顔をカメラに映しました。,かのじょ の えがお を カメラ に うつしました,,,, 
企画,きかく,新しいイベントを企画しました。,あたらしい イベント を きかく しました,,,, 
画家,がか,彼は有名な画家です。,かれ は ゆうめい な がか です,,,, 
区画,くかく,この区画には駐車スペースがあります。,この くかく に は ちゅうしゃ スペース が あります,,,, 
画面,がめん,パソコンの画面が暗くなりました。,パソコン の がめん が くらく なりました,,,, 
キリスト,キリスト,キリストの教えを学びました。,キリスト の おしえ を まなびました,,,, 
地面,じめん,地面が濡れています。,じめん が ぬれています,,,, 
水面,すいめん,湖の水面が光っています。,みずうみ の すいめん が ひかっています,,,, 
一面,いちめん,雪が一面に広がっています。,ゆき が いちめん に ひろがっています,,,, 
真実,しんじつ,真実はいつも一つです。,しんじつ は いつも ひとつ です,,,, 
真理,しんり,彼は哲学で真理を追求しています。,かれ は てつがく で しんり を ついきゅう しています,,,, 
金色,きんいろ,金色の夕日がとても美しいです。,きんいろ の ゆうひ が とても うつくしい です,,,, 
形式,けいしき,正式な形式で文書を提出してください。,せいしき な けいしき で ぶんしょ を ていしゅつ して ください,,,, 
小型,こがた,小型のカメラを購入しました。,こがた の カメラ を こうにゅう しました,,,, 
型,かた,この型はケーキ作りに最適です。,この かた は ケーキ づくり に さいてき です,,,, 
一種,いっしゅ,これは一種の芸術作品です。,これ は いっしゅ の げいじゅつ さくひん です,,,, 
各種,かくしゅ,各種の料理が用意されています。,かくしゅ の りょうり が ようい されて います,,,, 
人種,じんしゅ,この映画は人種差別をテーマにしています。,この えいが は じんしゅ さべつ を テーマ に して います,,,, 
種目,しゅもく,運動会では多くの種目があります。,うんどうかい で は おおく の しゅもく が あります,,,, 
人類,じんるい,人類の未来を考える。,じんるい の みらい を かんがえる,,,, 
せっせと,せっせと,彼はせっせと庭仕事をしています。,かれ は せっせと にわしごと を して います,,,, 
書類,しょるい,必要な書類を準備してください。,ひつよう な しょるい を じゅんび して ください,,,, 
接近,せっきん,台風が接近しています。,たいふう が せっきん して います,,,, 
間接,かんせつ,その情報は間接的に得ました。,その じょうほう は かんせつてき に えました,,,, 
接する,せっする,新しい文化に接する機会がありました。,あたらしい ぶんか に せっする きかい が ありました,,,, 
角度,かくど,この写真はいい角度で撮れています。,この しゃしん は いい かくど で とれています,,,, 
三角形,さんかっけい,三角形の面積を計算してください。,さんかっけい の めんせき を けいさん してください,,,, 
曲線,きょくせん,この道は曲線が多いです。,この みち は きょくせん が おおい です,,,, 
カタログ,カタログ,新しい家具のカタログを見ています。,あたらしい かぐ の カタログ を みて います,,,, 
作曲,さっきょく,彼はクラシック音楽を作曲しています。,かれ は クラシック おんがく を さっきょく して います,,,, 
共通,きょうつう,彼らには共通の趣味があります。,かれら に は きょうつう の しゅみ が あります,,,, 
共通語,きょうつうご,日本語は日本国内の共通語です。,にほんご は にほん こくない の きょうつうご です,,,, 
共同,きょうどう,このプロジェクトは共同で進められています。,この プロジェクト は きょうどう で すすめられて います,,,, 
合同,ごうどう,合同練習が今日あります。,ごうどう れんしゅう が きょう あります,,,, 
一同,いちどう,我々一同、心よりお祝い申し上げます。,われわれ いちどう、こころ より おいわい もうしあげます,,,, 
以前,いぜん,彼と最後に会ったのは以前のことです。,かれ と さいご に あった の は いぜん の こと です,,,, 
ジャズ,ジャズ,彼女はジャズが大好きです。,かのじょ は ジャズ が だいすき です,,,, 
以下,いか,以下の資料をご覧ください。,いか の しりょう を ごらん ください,,,, 
以降,いこう,会議は3時以降に始まります。,かいぎ は 3じ いこう に はじまります,,,, 
以来,いらい,卒業以来、彼と会っていません。,そつぎょう いらい、かれ と あって いません,,,, 
以後,いご,以後、気をつけます。,いご、きを つけます,,,, 
下宿,げしゅく,大学の近くで下宿しています。,だいがく の ちかく で げしゅく して います,,,, 
漢和,かんわ,この辞書は漢和辞典です。,この じしょ は かんわ じてん です,,,, 
英和,えいわ,英和辞典を使って単語を調べます。,えいわ じてん を つかって たんご を しらべます,,,, 
西洋,せいよう,西洋の文化について学びました。,せいよう の ぶんか について まなびました,,,, 
サイン,サイン,有名な俳優にサインをもらいました。,ゆうめい な はいゆう に サイン を もらいました,,,, 
海洋,かいよう,海洋生物の研究をしています。,かいよう せいぶつ の けんきゅう を して います,,,, 
西洋人,せいようじん,彼は西洋人と結婚しました。,かれ は せいようじん と けっこん しました,,,, 
制服,せいふく,学校では制服を着ることが決まっています。,がっこう で は せいふく を きる こと が きまって います,,,, 
室内,しつない,室内でスポーツをするのが好きです。,しつない で スポーツ を する の が すき です,,,, 
親子,おやこ,親子で料理を楽しみました。,おやこ で りょうり を たのしみました,,,, 
親類,しんるい,親類が集まってパーティーをしました。,しんるい が あつまって パーティー を しました,,,, 
親しむ,したしむ,彼は自然と親しむことが好きです。,かれ は しぜん と したしむ こと が すき です,,,, 
ごまかす,ごまかす,彼は問題を適当にごまかしました。,かれ は もんだい を てきとう に ごまかしました,,,, 
親切,しんせつ,彼女はとても親切な人です。,かのじょ は とても しんせつ な ひと です,,,, 
親友,しんゆう,彼は私の親友です。,かれ は わたし の しんゆう です,,,, 
親指,おやゆび,親指を怪我しました。,おやゆび を けが しました,,,, 
親しみ,したしみ,彼女の親しみやすい性格が好きです。,かのじょ の したしみ やすい せいかく が すき です,,,, 
水族館,すいぞくかん,家族で水族館に行きました。,かぞく で すいぞくかん に いきました,,,, 
歳末,さいまつ,歳末の大セールが始まりました。,さいまつ の だいセール が はじまりました,,,, 
姉妹,しまい,彼女には姉妹が3人います。,かのじょ に は しまい が 3にん います,,,, 
インテリ,インテリ,彼はインテリで、本をたくさん読んでいます。,かれ は インテリ で、ほん を たくさん よんで います,,,, 
次第に,しだいに,彼の体調は次第に良くなっています。,かれ の たいちょう は しだいに よく なって います,,,, 
次第,しだい,会議の進行は状況次第です。,かいぎ の しんこう は じょうきょう しだい です,,,, 
息,いき,深く息を吸ってリラックスしてください。,ふかく いき を すって リラックス して ください,,,, 
休息,きゅうそく,しばらく休息を取った方がいいです。,しばらく きゅうそく を とった ほう が いい です,,,, 
