expression,reading,sentence,sentence_kana,sentence_audio,expression_audio,image_uri
元気,げんき,おかげさまで元気です,おかげさまで げんき です,元気_sentence.mp3,元気.mp3,,
勉強,べんきょう,日本語を勉強しています,にほんご を べんきょう しています,,勉強.mp3,,
それ,それ,それは本当に素晴らしいですね。,それ は ほんとうに すばらしい です ね。,,それ.mp3,,
恐ろしい,おそろしい,その山道は恐ろしいほど急だ。,その やまみち は おそろしい ほど きゅう だ。,,恐ろしい.mp3,,
一つ,ひとつ,りんごを一つください。,りんご を ひとつ ください。,,一つ.mp3,,
まあ,まあ,まあ、しょうがないですね。,まあ、しょうがない です ね。,,まあ.mp3,,
一,いち,一から始めましょう。,いち から はじめましょう。,,一.mp3,,
見える,みえる,星が空に見える。,ほし が そら に みえる。,,見える.mp3,,
頃,ころ,子供の頃を思い出す。,こども の ころ を おもいだす。,,頃.mp3,,
小さい,ちいさい,小さい犬が庭にいる。,ちいさい いぬ が にわ に いる。,,小さい.mp3,,
古い,ふるい,この家は古いけど丈夫だ。,この いえ は ふるい けど じょうぶ だ。,,古い.mp3,,
動く,うごく,ロボットが動いている。,ろぼっと が うごいている。,,動く.mp3,,
足,あし,足が痛いです。,あし が いたい です,,足.mp3,,
逃げる,にげる,彼は警察から逃げた。,かれ は けいさつ から にげた。,,逃げる.mp3,,
どうして,どうして,どうして来なかったの？,どうして こなかった の？,,どうして.mp3,,
時々,ときどき,時々海に行きます。,ときどき うみ に いきます,,時々.mp3,,
忙しい,いそがしい,今週はとても忙しいです。,こんしゅう は とても いそがしい です,,忙しい.mp3,,
田,た,田んぼで働いている。,たんぼ で はたらいている,,田.mp3,,
今,いま,今は何時ですか？,いま は なんじ です か？,,今.mp3,,
十分,じゅうぶん,時間は十分あります。,じかん は じゅうぶん あります,,十分.mp3,,
急ぐ,いそぐ,バスに急ごう。,ばす に いそごう,,急ぐ.mp3,,
手入れ,ていれ,庭の手入れをしました。,にわ の ていれ を しました,,手入れ.mp3,,
賢い,かしこい,彼はとても賢い学生です。,かれ は とても かしこい がくせい です,,賢い.mp3,,
来る,くる,友達が来ます。,ともだち が きます,,来る.mp3,,
応援,おうえん,試合で応援します。,しあい で おうえん します,,応援.mp3,,
お祖母さん,おばあさん,お祖母さんと一緒に住んでいます。,おばあさん と いっしょ に すんでいます,,お祖母さん.mp3,,
隣,となり,隣の部屋は空いている。,となり の へや は あいている,,隣.mp3,,
センター,センター,町のセンターに行きました。,まち の せんたー に いきました,,センター.mp3,,
管理,かんり,データ管理をしています。,でーた かんり を しています,,管理.mp3,,
お姉さん,おねえさん,お姉さんは学校に行っています。,おねえさん は がっこう に いっています,,お姉さん.mp3,,
大変,たいへん,仕事は大変です。,しごと は たいへん です,,大変.mp3,,
夢,ゆめ,いい夢を見ました。,いい ゆめ を みました,,夢.mp3,,
時,とき,学生の時、楽しかったです。,がくせい の とき、たのしかった です,,時.mp3,,
やっぱり,やっぱり,やっぱり雨が降った。,やっぱり あめ が ふった,,やっぱり.mp3,,
便所,べんじょ,便所はどこですか？,べんじょ は どこ です か？,,便所.mp3,,
階段,かいだん,階段を上がってください。,かいだん を あがって ください,,階段.mp3,,
仕事,しごと,仕事を終わらせた。,しごと を おわらせた,,仕事.mp3,,
上,うえ,机の上に本があります。,つくえ の うえ に ほん が あります,,上.mp3,,
入る,はいる,部屋に入ってください。,へや に はいって ください,,入る.mp3,,
出る,でる,部屋から出てください。,へや から でて ください,,出る.mp3,,
目,め,目が痛いです。,め が いたい です,,目.mp3,,
どこ,どこ,どこに行きたいですか？,どこ に いきたい です か？,,どこ.mp3,,
好き,すき,私は日本料理が好きです。,わたし は にほんりょうり が すき です,,好き.mp3,,
気,き,気をつけてください。,き を つけて ください,,気.mp3,,
天気,てんき,今日はいい天気ですね。,きょう は いい てんき です ね。,,天気.mp3,,
開ける,あける,窓を開けてください。,まど を あけて ください,,開ける.mp3,,
見せる,みせる,写真を見せてください。,しゃしん を みせて ください,,見せる.mp3,,
ここ,ここ,ここに座ってください。,ここ に すわって ください,,ここ.mp3,,
部屋,へや,部屋を掃除しました。,へや を そうじ しました,,部屋.mp3,,
早い,はやい,電車は早いですね。,でんしゃ は はやい です ね。,,早い.mp3,,
お願い,おねがい,少し待ってください、お願いします。,すこし まって ください、おねがいします,,お願い.mp3,,
落ちる,おちる,リンゴが木から落ちました。,りんご が き から おちました,,落ちる.mp3,,
木,き,公園に大きな木があります。,こうえん に おおきな き が あります,,木.mp3,,
何か,なにか,何か質問はありますか？,なにか しつもん は あります か？,,何か.mp3,,
中,なか,箱の中を見てください。,はこ の なか を みて ください,,中.mp3,,
雨,あめ,雨が降っています。,あめ が ふっています,,雨.mp3,,
明るい,あかるい,彼は明るい性格です。,かれ は あかるい せいかく です,,明るい.mp3,,
暗い,くらい,部屋が暗いですね。,へや が くらい です ね。,,暗い.mp3,,
黒い,くろい,黒い猫がいました。,くろい ねこ が いました,,黒い.mp3,,
魚,さかな,魚を食べました。,さかな を たべました,,魚.mp3,,
急に,きゅうに,急に雨が降り出しました。,きゅうに あめ が ふりだしました,,急に.mp3,,
運ぶ,はこぶ,箱を部屋に運びました。,はこ を へや に はこびました,,運ぶ.mp3,,
早く,はやく,早く帰ってください。,はやく かえって ください,,早く.mp3,,
橋,はし,橋を渡りました。,はし を わたりました,,橋.mp3,,
裏,うら,家の裏に庭があります。,いえ の うら に にわ が あります,,裏.mp3,,
草,くさ,草を刈りました。,くさ を かりました,,草.mp3,,
壁,かべ,壁に絵がかかっています。,かべ に え が かかっています,,壁.mp3,,
湯,ゆ,湯を沸かしています。,ゆ を わかしています,,湯.mp3,,
戸,と,戸を閉めてください。,と を しめて ください,,戸.mp3,,
こんなに,こんなに,こんなに美しい景色は見たことがありません。,こんなに うつくしい けしき は みたこと が ありません,,こんなに.mp3,,
お巡りさん,おまわりさん,お巡りさんに道を聞きました。,おまわりさん に みち を ききました,,お巡りさん.mp3,,
腐る,くさる,牛乳が腐りました。,ぎゅうにゅう が くさりました,,腐る.mp3,,
絵本,えほん,子供に絵本を読みました。,こども に えほん を よみました,,絵本.mp3,,
いらっしゃる,いらっしゃる,先生がいらっしゃいました。,せんせい が いらっしゃいました,,いらっしゃる.mp3,,
きらりと,きらりと,星がきらりと光りました。,ほし が きらりと ひかりました,,きらりと.mp3,,
光,ひかり,太陽の光が強いです。,たいよう の ひかり が つよい です,,光.mp3,,
玉,たま,丸い玉を拾いました。,まるい たま を ひろいました,,玉.mp3,,
気に入る,きにいる,この本が気に入りました。,この ほん が きにいりました,,気に入る.mp3,,
光る,ひかる,時計が光っています。,とけい が ひかっています,,光る.mp3,,
引っ越し,ひっこし,引っ越しの準備をしています。,ひっこし の じゅんび を しています,,引っ越し.mp3,,
引っ越す,ひっこす,新しい家に引っ越しました。,あたらしい いえ に ひっこしました,,引っ越す.mp3,,
お父さん,おとうさん,お父さんが料理を作っています。,おとうさん が りょうり を つくっています,,お父さん.mp3,,
郊外,こうがい,郊外に住んでいます。,こうがい に すんでいます,,郊外.mp3,,
移る,うつる,彼は新しい職場に移りました。,かれ は あたらしい しょくば に うつりました,,移る.mp3,,
隠れる,かくれる,猫が机の下に隠れています。,ねこ が つくえ の した に かくれています,,隠れる.mp3,,
ああ,ああ,ああ、それは大変ですね。,ああ、それ は たいへん です ね,,ああ.mp3,,
あいづち,あいづち,彼の話にあいづちを打った。,かれ の はなし に あいづち を うった,,あいづち.mp3,,
あいにく,あいにく,あいにくですが、その日は予定があります。,あいにく です が、その ひ は よてい が あります,,あいにく.mp3,,
あえて,あえて,彼はあえて困難に挑戦した。,かれ は あえて こんなん に ちょうせん した,,あえて.mp3,,
あきれる,あきれる,彼の態度にあきれた。,かれ の たいど に あきれた,,あきれる.mp3,,
あくび,あくび,眠くてあくびをした。,ねむくて あくび を した,,あくび.mp3,,
あぐら,あぐら,彼はあぐらをかいて座った。,かれ は あぐら を かいて すわった,,あぐら.mp3,,
あげる,あげる,この本を友達にあげた。,この ほん を ともだち に あげた,,あげる.mp3,,
あそこ,あそこ,あそこに行きたいです。,あそこ に いきたい です,,あそこ.mp3,,
あだな,あだな,彼のあだなは「たけちゃん」です。,かれ の あだな は「たけちゃん」です,,あだな.mp3,,
あちこち,あちこち,朝からあちこち歩いた。,あさ から あちこち あるいた,,あちこち.mp3,,
あちら,あちら,あちらに座ってください。,あちら に すわって ください,,あちら.mp3,,
あちらこちら,あちらこちら,あちらこちらで紅葉がきれいです。,あちらこちら で こうよう が きれい です,,あちらこちら.mp3,,
あっさり,あっさり,彼はあっさりと負けを認めた。,かれ は あっさり と まけ を みとめた,,あっさり.mp3,,
あっち,あっち,郵便局はあっちです。,ゆうびんきょく は あっち です,,あっち.mp3,,
あなた,あなた,あなたの名前は何ですか。,あなた の なまえ は なん です か,,あなた.mp3,,
あふれる,あふれる,川の水があふれている。,かわ の みず が あふれて いる,,あふれる.mp3,,
あまり,あまり,あまり気にしないでください。,あまり き に しない で ください,,あまり.mp3,,
あらかじめ,あらかじめ,あらかじめ必要なものを書いておいた。,あらかじめ ひつよう な もの を かいて おいた,,あらかじめ.mp3,,
あり,あり,ありが砂糖にたかっている。,あり が さとう に たかって いる,,あり.mp3,,
あれ,あれ,あれは何ですか。,あれ は なん です か,,あれ.mp3,,
あれこれ,あれこれ,服を買うのにあれこれ迷った。,ふく を かう の に あれこれ まよった,,あれこれ.mp3,,
あんなに,あんなに,あんなに楽しい時間を過ごした。,あんなに たのしい じかん を すごした,,あんなに.mp3,,
あんまり,あんまり,あんまり好きじゃない。,あんまり すき じゃ ない,,あんまり.mp3,,
いい加減,いいかげん,いい加減なことを言わないでください。,いいかげん な こと を いわない で ください,,いい加減.mp3,,
いか,いか,いかの刺身を食べた。,いか の さしみ を たべた,,,
いかが,いかが,紅茶はいかがですか。,こうちゃ は いかが です か,,いかが.mp3,,
いかに,いかに,彼がいかに素晴らしい人かを知った。,かれ が いかに すばらしい ひと か を しった,,いかに.mp3,,
いかにも,いかにも,彼はいかにも賢そうだ。,かれ は いかにも かしこそう だ,,いかにも.mp3,,
いきなり,いきなり,いきなり雨が降り出した。,いきなり あめ が ふりだした,,いきなり.mp3,,
いけない,いけない,遅刻してはいけない。,ちこく して は いけない,,いけない.mp3,,
いずれ,いずれ,いずれまた会いましょう。,いずれ また あいましょう,,いずれ.mp3,,
岸,きし,川の岸でピクニックをした。,かわ の きし で ぴくにっく を した,,岸.mp3,,
いたずら,いたずら,子供がいたずらをして怒られた。,こども が いたずら を して おこられた,,いたずら.mp3,,
いちいち,いちいち,いちいち説明しなくてもいいよ。,いちいち せつめい しなくても いい よ,,いちいち.mp3,,
いつ,いつ,いつ日本に来ますか。,いつ にほん に きます か,,いつ.mp3,,
いつか,いつか,いつかまた会いましょう。,いつか また あいましょう,,いつか.mp3,,
いつごろ,いつごろ,試験はいつごろですか。,しけん は いつごろ です か,,いつごろ.mp3,,
いつでも,いつでも,いつでも連絡してください。,いつでも れんらく して ください,,いつでも.mp3,,
いつのまに,いつのまに,いつのまにか雨が止んでいた。,いつのまにか あめ が やんで いた,,いつのまに.mp3,,
いつのまにか,いつのまにか,いつのまにか眠ってしまった。,いつのまにか ねむって しまった,,いつのまにか.mp3,,
いつまでも,いつまでも,いつまでも健康でいてください。,いつまでも けんこう で いて ください,,いつまでも.mp3,,
いつも,いつも,彼女はいつも笑顔です。,かのじょ は いつも えがお です,,いつも.mp3,,
いとこ,いとこ,いとこと一緒に旅行した。,いとこ と いっしょ に りょこう した,,いとこ.mp3,,
いびき,いびき,彼のいびきがうるさかった。,かれ の いびき が うるさかった,,いびき.mp3,,
いやいや,いやいや,いやいや仕事をするのはつらい。,いやいや しごと を する の は つらい,,いやいや.mp3,,
いやらしい,いやらしい,いやらしい目で見ないで。,いやらしい め で みないで,,いやらしい.mp3,,
いよいよ,いよいよ,いよいよ試験が始まる。,いよいよ しけん が はじまる,,いよいよ.mp3,,
いらいら,いらいら,渋滞でいらいらしている。,じゅうたい で いらいら して いる,,いらいら.mp3,,
うがい,うがい,風邪予防にうがいをする。,かぜ よぼう に うがい を する,,うがい.mp3,,
うきうき,うきうき,プレゼントをもらってうきうきしている。,ぷれぜんと を もらって うきうき して いる,,うきうき.mp3,,
うちわ,うちわ,夏祭りでうちわを買った。,なつまつり で うちわ を かった,,うちわ.mp3,,
うっかり,うっかり,うっかりミスをしてしまった。,うっかり みす を して しまった,,うっかり.mp3,,
うつむく,うつむく,彼は恥ずかしそうにうつむいた。,かれ は はずかしそう に うつむいた,,うつむく.mp3,,
うどん,うどん,お昼にうどんを食べた。,おひる に うどん を たべた,,うどん.mp3,,
うなずく,うなずく,彼女はうなずいて同意した。,かのじょ は うなずいて どうい した,,うなずく.mp3,,
うまい,うまい,この料理は本当にうまいですね。,この りょうり は ほんとうに うまい です ね,,うまい.mp3,,
うるさい,うるさい,隣の部屋がうるさいです。,となり の へや が うるさい です,,うるさい.mp3,,
うろうろ,うろうろ,道に迷ってうろうろしていた。,みち に まよって うろうろ して いた,,うろうろ.mp3,,
えび,えび,えびの天ぷらが好きです。,えび の てんぷら が すき です,,えび.mp3,,
おいしい,おいしい,お寿司は本当においしかった。,おすし は ほんとうに おいしかった,,おいしい.mp3,,
おかしい,おかしい,今日の君の行動はおかしい。,きょう の きみ の こうどう は おかしい,,おかしい.mp3,,
おかず,おかず,昼ごはんにおいしいおかずを食べた。,ひるごはん に おいしい おかず を たべた,,おかず.mp3,,
おごる,おごる,彼が夕食をごちそうしてくれた。,かれ が ゆうしょく を ごちそう して くれた,,おごる.mp3,,
おしゃべり,おしゃべり,私たちは長い時間おしゃべりしました。,わたしたち は ながい じかん おしゃべり しました,,おしゃべり.mp3,,
おしゃれ,おしゃれ,彼女はとてもおしゃれなドレスを着ています。,かのじょ は とても おしゃれな どれす を きています,,おしゃれ.mp3,,
おじ,おじ,私のおじは大阪に住んでいます。,わたし の おじ は おおさか に すんでいます,,おじ.mp3,,
おじさん,おじさん,おじさんが道を教えてくれた。,おじさん が みち を おしえて くれた,,おじさん.mp3,,
おだてる,おだてる,彼は目的を果たすためにおだてた。,かれ は もくてき を はたす ため に おだてた,,おだてる.mp3,,
おっしゃる,おっしゃる,先生は何とおっしゃいましたか。,せんせい は なん と おっしゃいました か,,おっしゃる.mp3,,
おなか,おなか,おなかが痛いです。,おなか が いたい です,,おなか.mp3,,
おにぎり,おにぎり,昼食におにぎりを食べました。,ちゅうしょく に おにぎり を たべました,,おにぎり.mp3,,
おば,おば,私のおばはとても優しいです。,わたし の おば は とても やさしい です,,おば.mp3,,
おばさん,おばさん,おばさんは店で親切でした。,おばさん は みせ で しんせつ でした,,おばさん.mp3,,
おまけ,おまけ,おまけとして小さなプレゼントをもらいました。,おまけ として ちいさな ぷれぜんと を もらいました,,おまけ.mp3,,
おもちゃ,おもちゃ,このおもちゃは小さい子供向けです。,この おもちゃ は ちいさい こどもむけ です,,おもちゃ.mp3,,
おやつ,おやつ,午後のおやつにお菓子を食べました。,ごご の おやつ に おかし を たべました,,おやつ.mp3,,
およそ,およそ,旅行はおよそ3時間かかりました。,りょこう は およそ さんじかん かかりました,,およそ.mp3,,
お世辞,おせじ,彼は私のドレスにお世辞を言った。,かれ は わたし の どれす に おせじ を いった,,お世辞.mp3,,
お中元,おちゅうげん,私は上司にお中元を贈りました。,わたし は じょうし に おちゅうげん を おくりました,,お中元.mp3,,
お互い,おたがい,お互いに助け合うべきです。,おたがい に たすけあう べき です,,お互い.mp3,,
お仕舞い,おしまい,それが物語のお仕舞いでした。,それ が ものがたり の おしまい でした,,お仕舞い.mp3,,
お兄さん,おにいさん,私のお兄さんは東京で働いています。,わたし の おにいさん は とうきょう で はたらいています,,お兄さん.mp3,,
お前,おまえ,お前はそこで何をしているの？,おまえ は そこで なに を している の,,お前.mp3,,
お医者さん,おいしゃさん,明日お医者さんに行きます。,あした おいしゃさん に いきます,,お医者さん.mp3,,
お参り,おまいり,私たちは神社にお参りして祈りました。,わたしたち は じんじゃ に おまいり して いのりました,,お参り.mp3,,
近く,ちかく,図書館は学校の近くにあります。,としょかん は がっこう の ちかく に あります,,近く.mp3,,
二,に,二人で映画を見に行きました。,ふたり で えいが を みに いきました,,二.mp3,,
二つ,ふたつ,りんごを二つ買いました。,りんご を ふたつ かいました,,二つ.mp3,,
三,さん,三階に住んでいます。,さんかい に すんでいます,,三.mp3,,
三つ,みっつ,みかんを三つ食べました。,みかん を みっつ たべました,,三つ.mp3,,
四つ,よっつ,箱の中に四つのおもちゃがあります。,はこ の なか に よっつ の おもちゃ が あります,,四つ.mp3,,
四,よん,四人がパーティーに来ました。,よにん が ぱーてぃー に きました,,,
これ,これ,これが私のペンです。,これ が わたし の ぺん です,,これ.mp3,,
四,し,四時に出発します。,しじ に しゅっぱつ します,,,
五つ,いつつ,花を五つ買いました。,はな を いつつ かいました,,五つ.mp3,,
五,ご,五本の鉛筆を使っています。,ごほん の えんぴつ を つかっています,,五.mp3,,
六つ,むっつ,六つの質問があります。,むっつ の しつもん が あります,,六つ.mp3,,
六,ろく,六ヶ月間日本に住んでいました。,ろっかげつかん にほん に すんでいました,,六.mp3,,
七,なな,七時に起きました。,ななじ に おきました,,,
七つ,ななつ,ケーキを七つ作りました。,けーき を ななつ つくりました,,七つ.mp3,,
八,はち,八人が集まりました。,はちにん が あつまりました,,八.mp3,,
八つ,やっつ,八つの箱があります。,やっつ の はこ が あります,,八つ.mp3,,
なる,なる,彼は医者になりました。,かれ は いしゃ に なりました,,なる.mp3,,
九,きゅう,九月に旅行します。,きゅうがつ に りょこう します,,九.mp3,,
九つ,ここのつ,九つのプレゼントをもらいました。,ここのつ の ぷれぜんと を もらいました,,九つ.mp3,,
十,じゅう,十冊の本を読みました。,じゅっさつ の ほん を よみました,,十.mp3,,
百,ひゃく,百円でお菓子を買いました。,ひゃくえん で おかし を かいました,,百.mp3,,
千,せん,千羽の鶴を折った。,せんば の つる を おった,,千.mp3,,
万,まん,日本には一万の神がいると言われています。,にほん には いちまん の かみ が いる と いわれて います,,万.mp3,,
円,えん,円を描いてください。または千円を払いました。,えん を かいて ください。または せんえん を はらいました,,,
する,する,宿題をする。,しゅくだい を する,,する.mp3,,
日,にち,今日は良い日です。,きょう は よい ひ です,,日.mp3,,
六日,むいか,六日に会いましょう。,むいか に あいましょう,,六日.mp3,,
三日,みっか,三日間、旅行しました。,みっかかん、りょこう しました,,三日.mp3,,
五日,いつか,五日に試験があります。,いつか に しけん が あります,,五日.mp3,,
八日,ようか,八日間、何も食べていません。,ようかかん、なにも たべて いません,,八日.mp3,,
二十日,はつか,二十日は休みです。,はつか は やすみ です,,二十日.mp3,,
二日,ふつか,二日間、寝ていました。,ふつかかん、ねて いました,,二日.mp3,,
九日,ここのか,九日に友達が来ます。,ここのか に ともだち が きます,,九日.mp3,,
ところ,ところ,静かなところに住みたいです。,しずか な ところ に すみたい です,,ところ.mp3,,
一日,いちにち,一日中、雨が降っていました。,いちにちじゅう、あめ が ふって いました,,一日.mp3,,
十日,とおか,十日に会議があります。,とおか に かいぎ が あります,,十日.mp3,,
七日,なのか,七日に映画を見に行きます。,なのか に えいが を みに いきます,,七日.mp3,,
四日,よっか,四日は祝日です。,よっか は しゅくじつ です,,四日.mp3,,
月,つき,月が明るい夜です。,つき が あかるい よる です,,月.mp3,,
水,みず,水を飲みたいです。,みず を のみたい です,,水.mp3,,
金,きん,金の指輪を買いました。,きん の ゆびわ を かいました,,金.mp3,,
日曜日,にちようび,日曜日は家で休みます。,にちようび は いえ で やすみます,,日曜日.mp3,,
土曜日,どようび,土曜日に友達と遊びます。,どようび に ともだち と あそびます,,土曜日.mp3,,
やる,やる,宿題をやらなければなりません。,しゅくだい を やらなければ なりません,,やる.mp3,,
